Upvotes,Title,col_2,col_3,col_4,col_5,Year,Subreddit
120,"Swallowed TRP 2 weeks ago. Today, I'm puking it back out! My story",,brightskies2094,/r/ExRedPill,18/10/14 05:25 AM,2014,ExRedPill
64,What turned me off the red pill,,,/r/ExRedPill,11/06/14 09:23 AM,2014,ExRedPill
48,TRP was filling a void,,slimjimjohnson,/r/ExRedPill,19/09/14 01:24 PM,2014,ExRedPill
44,My thoughts on why TRP is bad for your mind,,welcome2thegoodfight,/r/ExRedPill,02/11/14 06:21 PM,2014,ExRedPill
43,"I was a former redpiller, AMA",,,/r/ExRedPill,14/05/14 10:04 PM,2014,ExRedPill
36,Just threw up TRP? Read Models by Mark Manson.,,aggressive_radish,/r/ExRedPill,24/07/14 10:28 PM,2014,ExRedPill
26,"Active in the PUA world for years, discovered TRP a few months ago, part me of me was into it, quickly realized it (the Manosphere) has all gone to the sewers.",,Cyrusk4,/r/ExRedPill,01/07/14 10:12 PM,2014,ExRedPill
21,What are your goals? Is your only goal in life to have sex with beautiful women?,,f_u_nspellsfun,/r/ExRedPill,08/11/14 04:19 AM,2014,ExRedPill
19,"So, if I may ask, have you guys found feminism?",,rational_nonsense,/r/ExRedPill,04/09/14 05:10 PM,2014,ExRedPill
19,Are there actually any ex-Red Pill guys here?,,aaron_the_just,/r/ExRedPill,24/06/14 01:30 AM,2014,ExRedPill
16,How I got introduced to PUA ( Pick up artistry ) and got myself away from it,,phaedrusbrowne,/r/ExRedPill,10/07/14 10:42 PM,2014,ExRedPill
16,"xpost from EMSK: Why the ""Red Pill"" will kill you inside",,laskuraska,/r/ExRedPill,30/06/14 11:45 PM,2014,ExRedPill
16,Deconstructing the Red Pill dogma.,,recovering_red_pill,/r/ExRedPill,08/10/14 09:21 PM,2014,ExRedPill
16,Ask a former love-shy.com admin anything,,Rammspieler,/r/ExRedPill,25/09/14 05:29 AM,2014,ExRedPill
12,Finding the good amongst the bad,,IVIaskerade,/r/ExRedPill,11/09/14 09:50 AM,2014,ExRedPill
12,Two things that helped me get better with women (not exactly PUA),,phaedrusbrowne,/r/ExRedPill,10/07/14 11:03 PM,2014,ExRedPill
12,"Not an exrp, but very grateful this sub exists",,lucywolf,/r/ExRedPill,23/06/14 08:33 PM,2014,ExRedPill
12,I'm never going to break my misogyny,,kekeek,/r/ExRedPill,27/11/14 02:33 AM,2014,ExRedPill
11,I'm teetering on the edge.,,,/r/ExRedPill,29/09/14 03:37 PM,2014,ExRedPill
10,But did it work?,,,/r/ExRedPill,05/09/14 11:21 PM,2014,ExRedPill
10,How would you like life to look now? Where do you go now?,,qwrtyq,/r/ExRedPill,20/07/14 09:05 AM,2014,ExRedPill
10,How to stop feeling so dead inside,,redpillinsomnia,/r/ExRedPill,06/11/14 02:04 PM,2014,ExRedPill
9,"[X-post /r/TheBluePill] ""I've denounced TRP lifestyle. The Red Pill is incredibly dangerous, and I know this because I witnessed it first hand.""",,Leagle_Egal,/r/ExRedPill,29/05/14 08:53 PM,2014,ExRedPill
9,"Does someone who had subscribed to TRP and had put their philosophy in practice achieved success in dates, but stopped using their methods because they found them not correct and based in bullshit?",,coscorrodrift,/r/ExRedPill,03/11/14 05:56 PM,2014,ExRedPill
9,ExRed to Purple Pill and now ExPurplePill. Didn't go Blue Pill either. I'm not any pill.,,,/r/ExRedPill,16/10/14 01:26 AM,2014,ExRedPill
8,Mod Introduction: whisperHailHydra,,whisperHailHydra,/r/ExRedPill,22/06/14 12:51 AM,2014,ExRedPill
8,Toxic Thursday!,,laskuraska,/r/ExRedPill,20/06/14 12:45 AM,2014,ExRedPill
8,Fighting Hate with Love?,,KillerBeetz,/r/ExRedPill,09/06/14 07:03 PM,2014,ExRedPill
8,"""I was a redpiller"" [Cross-post /r/TheBluePill]",,Leagle_Egal,/r/ExRedPill,30/05/14 07:34 PM,2014,ExRedPill
7,"Found a subreddit devoted to identifying red pill extremist thinking. Pretty funny, actually.",,,/r/ExRedPill,25/08/14 08:56 PM,2014,ExRedPill
7,What do you think of super-feminists?,,shoeboat,/r/ExRedPill,13/07/14 08:15 PM,2014,ExRedPill
7,Zubazine's Redpill cleanse,,laskuraska,/r/ExRedPill,22/06/14 03:58 AM,2014,ExRedPill
7,"[X-post /r/TheBluePill] ""Former redpill dude just lost my shit today share with you my story.""",,Leagle_Egal,/r/ExRedPill,02/06/14 06:55 PM,2014,ExRedPill
7,"[X-post /r/TheBluePill] ""Almost swallowed that red pill .....""",,Leagle_Egal,/r/ExRedPill,05/06/14 05:52 PM,2014,ExRedPill
7,Free,,,/r/ExRedPill,05/11/14 09:03 AM,2014,ExRedPill
6,"""I went through a Red Pill phase, pretty weird time in my life"" [X-post /r/TheBluePill]",,Leagle_Egal,/r/ExRedPill,16/06/14 09:15 PM,2014,ExRedPill
5,"Red Pill, Liberal Parents",,phaedrusbrowne,/r/ExRedPill,09/07/14 09:41 PM,2014,ExRedPill
5,"Gentlemen of exredpill, I introduce a new sub, /r/getmasculine!",,laskuraska,/r/ExRedPill,03/07/14 04:35 AM,2014,ExRedPill
5,"[X-post /r/TheBluePill] ""TRP - Why I actually believed this shit for a month or two""",,Leagle_Egal,/r/ExRedPill,03/06/14 05:22 PM,2014,ExRedPill
5,"[X-post /r/TheBluePill] ""My experience with TRP""",,Leagle_Egal,/r/ExRedPill,01/06/14 07:37 PM,2014,ExRedPill
4,"[X-post /r/TheBluePill] ""Thank you TBP (serious self-reflection)""",,Leagle_Egal,/r/ExRedPill,04/06/14 07:12 PM,2014,ExRedPill
4,"[X-post /r/TheBluePill] ""This circle-jerk actually helped me out of a bad place, so thanks""",,Leagle_Egal,/r/ExRedPill,31/05/14 05:29 PM,2014,ExRedPill
1,"Hi, I once dated a red pill guy. How do i get over being verbally, emotionally, physically abused by a little tiny weenie of a guy!?",,,/r/ExRedPill,21/06/14 08:09 PM,2014,ExRedPill
0,Wrote a book about the nihilistic lifestyle that partying and promiscuity fosters inside men,,,/r/ExRedPill,07/11/14 09:54 AM,2014,ExRedPill
0,So how pervasive is this rape thing?,,barkafas2,/r/ExRedPill,28/10/14 04:13 AM,2014,ExRedPill
92,I think I want to cough up the pill,,BlakeTheTank,/r/ExRedPill,22/02/15 01:40 PM,2015,ExRedPill
63,I think my boyfriend is turning red.,,Poptartsnkittens,/r/ExRedPill,06/12/15 11:33 PM,2015,ExRedPill
43,"I want to let you all know about a sub I just found out about. /r/MensLib. I know what you're thinking, but it's nothing like /r/MensRights. In fact, it was created specifically as a place for people to discuss men's issues in an environment free of misogyny, anti-feminism, and vitriol.",,Dewey_Darl,/r/ExRedPill,04/08/15 02:16 AM,2015,ExRedPill
37,"TRP turned me into a living, walking, breathing douche bag...",,1newworldorder,/r/ExRedPill,01/09/15 01:17 PM,2015,ExRedPill
37,The falsity of Red Pill,,,/r/ExRedPill,02/05/15 01:07 AM,2015,ExRedPill
36,"When you realize how simple TRP's strategy is, it's easier to move on from. [vent]",,rainstormrabbit,/r/ExRedPill,21/10/15 02:50 AM,2015,ExRedPill
35,How to fight red pill in marriage?,,,/r/ExRedPill,14/09/15 08:48 PM,2015,ExRedPill
34,[Discussion] Did you have any suspicions about TRP that you initially ignored?,,give_me_evidence,/r/ExRedPill,31/08/15 01:56 AM,2015,ExRedPill
32,Just got BANNED from the Red Pill forums for challenging premises,,theredpoo,/r/ExRedPill,29/07/15 06:11 PM,2015,ExRedPill
31,Why taking the pill was one of the worst moves I have EVER made (story inside),,potsy5656,/r/ExRedPill,21/04/15 02:12 AM,2015,ExRedPill
30,My personal experience with the Red Pill mindset.,,ThatShoegazer,/r/ExRedPill,18/07/15 06:58 PM,2015,ExRedPill
29,The good advice of TRP -- distilled here (and made less stupid) so you no longer have to read TRP [x-post TBP),,bluepill_alphabrah,/r/ExRedPill,23/06/15 08:07 PM,2015,ExRedPill
28,Why I left TheRedPill,,,/r/ExRedPill,13/04/15 01:35 PM,2015,ExRedPill
24,Calling out Red Pill baloney mindsets about dating and girlfriends.,,Cyrusk4,/r/ExRedPill,23/03/15 12:22 PM,2015,ExRedPill
24,"How TRP almost got me, why I left, and how they took my best friend from me. Please help?",,nopillforme,/r/ExRedPill,14/01/15 01:38 AM,2015,ExRedPill
24,Awakening from the Awakening: My Observations and Analysis of TRP,,MrRubes,/r/ExRedPill,14/01/15 02:34 AM,2015,ExRedPill
23,Just thank you (originally posted at /r/TheBluePill),,,/r/ExRedPill,03/09/15 01:36 AM,2015,ExRedPill
22,What Red Pill thinks women do in their spare time.,,,/r/ExRedPill,17/09/15 03:20 AM,2015,ExRedPill
22,Help Me build the Ex Red Pill Dating Guide,,Niess,/r/ExRedPill,08/09/15 04:17 PM,2015,ExRedPill
21,Struggling to believe current societal conditions can foster an environment where women give love to men,,tinytiger4321,/r/ExRedPill,13/11/15 02:41 PM,2015,ExRedPill
21,Psychology of a Gynophobe: Red Pill's misogyny may stem from infancy.,,tinytiger4321,/r/ExRedPill,10/09/15 03:25 AM,2015,ExRedPill
20,The PUA / TRP disconnection from how normal healthy adults see sex and relationships.,,Cyrusk4,/r/ExRedPill,06/04/15 01:30 PM,2015,ExRedPill
19,Can I learn to trust an ex redpill guy?,,Lysmerry,/r/ExRedPill,19/11/15 01:22 AM,2015,ExRedPill
19,I Want to Forget the Red Pill,,thesouthernbear,/r/ExRedPill,27/08/15 06:58 AM,2015,ExRedPill
19,TRP's Influence on me and My decision to move on,,rollingcann,/r/ExRedPill,16/08/15 07:50 AM,2015,ExRedPill
19,Why I quit the Red Pill Reddit Forum,,plentyoffishes,/r/ExRedPill,20/06/15 09:11 PM,2015,ExRedPill
16,Why some redpillers do what they do.,,Ardubinston,/r/ExRedPill,04/09/15 04:29 PM,2015,ExRedPill
14,Why did you guys cough up the red pill?,,,/r/ExRedPill,11/05/15 07:06 AM,2015,ExRedPill
14,The more I read about TRP the more I disagree with it.,,HappilySingleWoman,/r/ExRedPill,30/04/15 03:33 PM,2015,ExRedPill
14,My story and conclusions (xpost from ppd),,,/r/ExRedPill,05/03/15 03:25 AM,2015,ExRedPill
13,"Not safe to even challenge TRP outside of certain subs, by associating with it in any form people hate you. How to deal with?",,Xemnas81,/r/ExRedPill,08/07/15 03:00 PM,2015,ExRedPill
13,"I want to explain the effect of the Red Pill to my ex and apologise, to heal our friendship. I don't know how to go about it. (Lengthy post)",,Xemnas81,/r/ExRedPill,22/06/15 07:32 PM,2015,ExRedPill
11,I am so damn unhappy.,,klukluxkafka,/r/ExRedPill,03/06/15 06:19 PM,2015,ExRedPill
11,I (f) am realizing my roommate (m) is TRP/PUA/MRA; looking for advice.,,TRProommie,/r/ExRedPill,24/05/15 09:33 AM,2015,ExRedPill
11,"Take the good, throw the rest in the trash",,,/r/ExRedPill,13/05/15 03:49 AM,2015,ExRedPill
10,Struggling to spit out the red pill [throwaway],,tinytiger4321,/r/ExRedPill,09/08/15 09:26 PM,2015,ExRedPill
10,"I came to the red pill because it was the only places which REALLY acknowledged sexism towards men…and even there, it was promoted",,Xemnas81,/r/ExRedPill,07/06/15 10:12 PM,2015,ExRedPill
9,"This is for you visible minorities (and other ex-trpers), I hope this helps.",,IAmQueer,/r/ExRedPill,21/06/15 04:03 AM,2015,ExRedPill
9,Getting Over IT,,Concreteiceshield,/r/ExRedPill,29/03/15 08:32 PM,2015,ExRedPill
9,How are you all doing?,,BaconLove101,/r/ExRedPill,05/02/15 06:37 AM,2015,ExRedPill
8,TRP turned me in to a person that I didn't want to be 4 months removed in a much better place,,,/r/ExRedPill,12/12/15 04:22 AM,2015,ExRedPill
7,Need help with a friend,,woodenshlong,/r/ExRedPill,08/05/15 10:28 AM,2015,ExRedPill
7,"Ive had no luck with women my whole life. Ive asked humbly for help but nothing has worked. TRP has given me some hope and motivation, but its not enough. Im still where I was when I came here looking for answers.",,ComplexBuffoon,/r/ExRedPill,27/01/15 12:00 AM,2015,ExRedPill
6,Give me a logical direction to go in,,db_db_db,/r/ExRedPill,14/10/15 05:40 AM,2015,ExRedPill
6,"The story of the Redpill, and how it changed my life.",,Stat1c16,/r/ExRedPill,18/07/15 06:52 AM,2015,ExRedPill
6,"A very involved post delving into the red pill. The good, the bad, the ugly. warning, you might not agree with everything, but please take the time to read.",,throwawayXRP,/r/ExRedPill,11/07/15 04:22 PM,2015,ExRedPill
6,“Fake It Til You Make It”? - Final Thoughts On Pickup Artist Julien Blanc & RSD,,,/r/ExRedPill,13/09/15 03:42 AM,2015,ExRedPill
6,The story of why I (25M) am so miserable after a few dozen women.,,,/r/ExRedPill,19/02/15 12:34 PM,2015,ExRedPill
4,Hi I am scouting for a people to contribute to a Purple pill pod cast IF you are interested pm me.,,wazzup987,/r/ExRedPill,27/02/15 11:01 PM,2015,ExRedPill
3,"IAMA Married ""Red Piller:"" Ask Me Anything, but please be civil",,MRP_Q-A,/r/ExRedPill,21/10/15 07:47 PM,2015,ExRedPill
2,is this still fine here?,,,/r/ExRedPill,04/02/15 12:22 PM,2015,ExRedPill
1,You have a chance to save me from TRP,,,/r/ExRedPill,26/12/15 08:58 AM,2015,ExRedPill
1,bluepill x-post: Writing an essay and need some insight from ex-redpillers,,mcchudge,/r/ExRedPill,25/05/15 05:25 PM,2015,ExRedPill
1,Leaving the red pill but unsure how to deal with my hurt...,,,/r/ExRedPill,12/08/15 11:58 PM,2015,ExRedPill
1,Question for Ex-Red Pillers: What is the attitude towards Asexual Men?,,,/r/ExRedPill,11/08/15 05:20 PM,2015,ExRedPill
1,"Ex-redpillers that are unattractive, how do you not hate women?",,,/r/ExRedPill,17/04/15 03:18 AM,2015,ExRedPill
1,"On why RedPillers really believe they have ""The Truth""",,fentrix5,/r/ExRedPill,27/03/15 01:26 PM,2015,ExRedPill
1,"On why RedPillers believe they have ""The Truth""",,fentrix6,/r/ExRedPill,27/03/15 04:10 PM,2015,ExRedPill
1,"Ive had no luck with women my whole life. Ive asked humbly for help but nothing has worked. TRP has given me some hope and motivation, but its not enough. Im still where I was when I came here looking for answers.",,,/r/ExRedPill,26/01/15 11:47 PM,2015,ExRedPill
0,I think the majority of exredpillers have an extreme caricature strawman of TRP ideas. CMV,,MorpheusGodOfDreams,/r/ExRedPill,23/12/15 10:35 PM,2015,ExRedPill
0,Married 20 years - lots of kids - Redpill Marriage. Ask away.,,,/r/ExRedPill,22/10/15 07:39 PM,2015,ExRedPill
0,What do you think?,,Meninismx,/r/ExRedPill,19/06/15 10:52 AM,2015,ExRedPill
0,I see parallels between TRP and the feminists they hate.,,Cyrusk4,/r/ExRedPill,23/03/15 03:00 PM,2015,ExRedPill
0,My pro-male anti-misoginy stance,,Nikolai-eu,/r/ExRedPill,08/03/15 01:27 PM,2015,ExRedPill
0,"Redpill since HS. Stopped about a year ago, life is turning to crap. And the worst part is that my family is suffering.",,ExExRepPill,/r/ExRedPill,12/02/15 10:12 AM,2015,ExRedPill
109,Need to vent... I really regret immersing myself in TRP.,,Mushy_is_C12H17N2O4P,/r/ExRedPill,23/08/16 12:17 AM,2016,ExRedPill
91,"AWALT Debunked (based on science) - No, not all women are like that!",,RedPillDetox,/r/ExRedPill,24/01/16 10:02 PM,2016,ExRedPill
75,My advice to you,,OmLiLi,/r/ExRedPill,01/11/16 03:56 AM,2016,ExRedPill
67,"No, your girlfriend doesn't want to cheat on you with a ""more alpha guy"" (based on science)",,RedPillDetox,/r/ExRedPill,18/01/16 06:06 PM,2016,ExRedPill
65,Against Dread Game (Based on Science),,RedPillDetox,/r/ExRedPill,20/01/16 11:40 PM,2016,ExRedPill
61,Why I left the Red Pill,,Tenthyoung,/r/ExRedPill,10/12/16 12:05 AM,2016,ExRedPill
57,Red Pill Detox First Aid Kit - Start Here!,,RedPillDetox,/r/ExRedPill,19/04/16 10:51 PM,2016,ExRedPill
56,The end of the Bad Boy Mystique - Largely overlooked reasons of why bad boys actually get laid (based on science),,RedPillDetox,/r/ExRedPill,24/02/16 11:35 PM,2016,ExRedPill
52,"If You're Lonely, Stay Far Away From TRP",,Ex_redpill_throwaway,/r/ExRedPill,18/07/16 05:48 AM,2016,ExRedPill
51,"""Game"" doesn't really work.",,RedPillDetox,/r/ExRedPill,14/02/16 10:58 PM,2016,ExRedPill
50,Why Red Pill is a Cult - Part 2 (Based on Mark Manson's writings),,RedPillDetox,/r/ExRedPill,30/10/16 02:31 PM,2016,ExRedPill
45,Ex-redpiller here. I think I have quite a bit to share.,,,/r/ExRedPill,16/03/16 12:28 PM,2016,ExRedPill
43,"Red Pill and Cultic Behavior - Why TRP is a lot like Scientology, Heaven's Gate and other cults (based on Science)",,RedPillDetox,/r/ExRedPill,04/02/16 04:17 PM,2016,ExRedPill
36,"Grew up in a RedPill household, am beginning to realize this may be why I can't hold a relationship",,bearsanddeers,/r/ExRedPill,12/05/16 09:43 PM,2016,ExRedPill
35,Did anyone of you find out that you're actually repressing same-sex attraction?,,keinalu,/r/ExRedPill,02/07/16 08:28 PM,2016,ExRedPill
35,Ex redpill woman here.,,skaytec,/r/ExRedPill,08/03/16 11:36 PM,2016,ExRedPill
34,Found my husband's red pill readings- how do I build trust again?,,QBall37,/r/ExRedPill,10/04/16 07:58 PM,2016,ExRedPill
31,"""I Was a Men’s Rights Activist"" – A former MRA recounts how got involved with the movement and how evolved into a feminist.",,mcdermottj,/r/ExRedPill,15/04/16 08:28 PM,2016,ExRedPill
31,Essential Readings to detox from Red Pill - Collection of posts from various authors,,RedPillDetox,/r/ExRedPill,13/02/16 08:59 PM,2016,ExRedPill
29,Beginning to See the Light,,CoughingItUp98,/r/ExRedPill,17/10/16 05:19 AM,2016,ExRedPill
24,My experience dating a Redpill/ MGTOW guy,,,/r/ExRedPill,21/06/16 10:08 AM,2016,ExRedPill
24,I took a couple of tools and left.,,Mortimer_Snerd,/r/ExRedPill,11/05/16 03:44 PM,2016,ExRedPill
24,What bothers me the most about this toxic culture...,,rawevillivewar,/r/ExRedPill,03/01/16 05:04 PM,2016,ExRedPill
23,Stumbled onto /r/redpill and tried to read with an open mind - I'm a woman and am emotionally shaken from what I read - anyone with tips on 'detoxing' from this?,,smurfsm00,/r/ExRedPill,29/04/16 02:46 AM,2016,ExRedPill
23,TRP and why I'm drinking on a Tuesday night,,LucilioVanini,/r/ExRedPill,03/02/16 08:39 AM,2016,ExRedPill
22,Why do so many Redpillers idealize asian women?,,Anna_rampage,/r/ExRedPill,09/06/16 08:17 PM,2016,ExRedPill
21,"I want to stop being misogynistic, but I still believe a lot of what TRP says",,LucioMain1994,/r/ExRedPill,02/12/16 08:42 AM,2016,ExRedPill
21,I subscribed for one day and left.,,unknownlaugh,/r/ExRedPill,18/08/16 06:52 AM,2016,ExRedPill
21,Nephew into TRP and similar philosophies,,wastedfucking,/r/ExRedPill,06/07/16 05:25 PM,2016,ExRedPill
21,Cmv on the redpill.,,TurnPunchKick,/r/ExRedPill,06/06/16 04:40 PM,2016,ExRedPill
20,"I'm shit sick of this 'pill' shit on this subreddit. I'm sick of science says this, the polls say that.",,TheRamofall,/r/ExRedPill,28/12/16 08:05 PM,2016,ExRedPill
20,"21F, Still feel very depressed about TRP/some aspects of evo-psych to the point of wanting to drop out of uni",,redpilldepression,/r/ExRedPill,11/06/16 05:21 PM,2016,ExRedPill
19,Hey are their any RPW here,,wazzup987,/r/ExRedPill,09/01/16 07:06 PM,2016,ExRedPill
18,There has to be a way to work constructive on men's issues.,,Mensmovementcom,/r/ExRedPill,29/12/16 12:47 AM,2016,ExRedPill
18,"How to ""detox"" as a female?",,stell4rbe4m,/r/ExRedPill,13/09/16 10:54 PM,2016,ExRedPill
17,Update: 3 interesting new studies that don't support TRP added to the First Aid Kit,,RedPillDetox,/r/ExRedPill,21/12/16 06:38 PM,2016,ExRedPill
17,There needs to be a red pill refugees,,stillaliveatage89,/r/ExRedPill,05/12/16 05:17 PM,2016,ExRedPill
17,Left TRP/MRP after 1 Year - My Experience,,stargazer35,/r/ExRedPill,22/08/16 03:38 PM,2016,ExRedPill
17,Thank you for this subreddit.,,jc_reddit,/r/ExRedPill,01/07/16 08:40 AM,2016,ExRedPill
17,Are you a feminist now?,,LMSoverP,/r/ExRedPill,27/05/16 03:50 AM,2016,ExRedPill
16,"42 year old woman, needing to detox from both TRP/PUA type thinking and RPW/Rules Girl/Pat Allen/Laura Doyle thinking",,mousesinger,/r/ExRedPill,05/06/16 03:47 AM,2016,ExRedPill
15,What are your thoughts on RPW?,,tiposk,/r/ExRedPill,26/06/16 12:21 AM,2016,ExRedPill
15,(Vent) Catharsis - What Red Pill does to an extremely self-aware man.,,EXRPTHA12,/r/ExRedPill,02/10/16 05:26 PM,2016,ExRedPill
15,How is MGTOW viewed by exredpill/purple pill?,,livelarge14,/r/ExRedPill,04/04/16 02:08 AM,2016,ExRedPill
14,Help me understand redpill,,Special-snowflake333,/r/ExRedPill,28/09/16 03:44 PM,2016,ExRedPill
14,"Do women want to be dominated by their partners? Appearently not, but researchers really seem to want to convince themselves otherwise.",,RedPillDetox,/r/ExRedPill,15/08/16 09:50 PM,2016,ExRedPill
14,My story. Help/advice is appreciated.,,rockintomordor,/r/ExRedPill,21/02/16 08:06 PM,2016,ExRedPill
14,"As it turns out, study suggests that Alfas buck to fuck ...",,RedPillDetox,/r/ExRedPill,17/01/16 03:00 PM,2016,ExRedPill
13,"AMA (Serious): Found TRP at 18, I am 21 now, and I left it.",,LegLockBrah,/r/ExRedPill,08/12/16 12:12 PM,2016,ExRedPill
13,Happy this sub exists,,10001110101abcd,/r/ExRedPill,06/12/16 03:27 PM,2016,ExRedPill
13,I don't know how to view women as people,,atim8,/r/ExRedPill,02/08/16 08:08 AM,2016,ExRedPill
13,Red Pill's AWALT comes from f-PUA books like Why Men Love Bitches and The Rules Revisited. What now?,,Xemnas81,/r/ExRedPill,25/03/16 12:11 PM,2016,ExRedPill
12,Flushing down the Red Pill (TRP),,BrysonTiller777,/r/ExRedPill,04/10/16 08:39 PM,2016,ExRedPill
12,Ex Truecel?,,RelationshipAdvice89,/r/ExRedPill,30/06/16 09:04 AM,2016,ExRedPill
12,I need a few questions answered...,,Disturbed_Angel,/r/ExRedPill,26/06/16 08:40 PM,2016,ExRedPill
12,Those Who Have Renounced The Red Pill...,,,/r/ExRedPill,22/01/16 10:52 PM,2016,ExRedPill
11,Journalist looking to interview a reformed MRA,,mcdermottj,/r/ExRedPill,08/04/16 09:18 PM,2016,ExRedPill
11,Going to change the perspective here a bit... how do I stop seeing men from the TRP perspective?,,rpwthrow11,/r/ExRedPill,29/02/16 08:58 PM,2016,ExRedPill
11,Need help,,ain4rfg93wi78j,/r/ExRedPill,28/02/16 10:19 PM,2016,ExRedPill
11,Help! I can't seem to get these unwanted RP thoughts out of my head.,,goldbludgeon,/r/ExRedPill,26/01/16 04:35 PM,2016,ExRedPill
10,"Apparently, socioeconomic status has very little influence on male attractiveness",,tiposk,/r/ExRedPill,21/11/16 01:12 AM,2016,ExRedPill
10,i feel like this reddit is unsupportive,,ExpGeo,/r/ExRedPill,15/11/16 02:27 PM,2016,ExRedPill
10,Can someone help me?,,norealitythrowaway,/r/ExRedPill,17/10/16 11:54 PM,2016,ExRedPill
10,I still don't think I understand what the hell theredpill is about?,,ChainsawChick,/r/ExRedPill,05/08/16 05:51 AM,2016,ExRedPill
10,My 2 month journey through r/theredpill has been a valuable one!,,RedMedi,/r/ExRedPill,12/05/16 09:58 AM,2016,ExRedPill
10,Thoughts wanted from ex-redpillers: What do you think of this conversation I had with an MRA?,,delta_baryon,/r/ExRedPill,29/01/16 10:32 PM,2016,ExRedPill
9,Genuine love exists?,,Shinoyi,/r/ExRedPill,01/12/16 06:14 PM,2016,ExRedPill
9,Close to another major relapse,,adorata,/r/ExRedPill,30/04/16 08:58 PM,2016,ExRedPill
9,"Need to vent myself here, emotional week.",,Iwasfrozentodaay,/r/ExRedPill,06/03/16 07:16 PM,2016,ExRedPill
9,I can't seem to shake off my RP-influenced views on women,,,/r/ExRedPill,29/02/16 11:58 AM,2016,ExRedPill
8,Attraction vs. Relationship Quality,,redpillanalyst,/r/ExRedPill,19/12/16 02:51 AM,2016,ExRedPill
8,Desperately looking for advice,,,/r/ExRedPill,15/12/16 06:35 AM,2016,ExRedPill
8,Going through a break-up and it's hard not to look at my relationship's failure from a TRP perspective,,laughingmatters,/r/ExRedPill,18/03/16 05:05 PM,2016,ExRedPill
8,OP:antibullshit X-post BP,,wazzup987,/r/ExRedPill,07/01/16 06:37 AM,2016,ExRedPill
7,Thought this might be useful to some of you,,,/r/ExRedPill,10/12/16 11:28 AM,2016,ExRedPill
7,In sickness and for poorer and for worse (rant),,stillaliveatage89,/r/ExRedPill,07/12/16 02:31 AM,2016,ExRedPill
7,If not TRP/PUA then what?,,ifnottrpthenwhat,/r/ExRedPill,27/11/16 05:10 PM,2016,ExRedPill
7,Fiction,,gollumwasthering,/r/ExRedPill,15/11/16 02:59 AM,2016,ExRedPill
7,Incel on the fence,,,/r/ExRedPill,22/09/16 06:46 PM,2016,ExRedPill
7,"Am lost, looking for signpost.",,Wranglyph,/r/ExRedPill,14/08/16 02:09 PM,2016,ExRedPill
7,My experiences with the RP philosophy,,ikyfse,/r/ExRedPill,08/07/16 01:15 AM,2016,ExRedPill
7,Is having female friends helpful? and other related questions,,,/r/ExRedPill,11/03/16 12:41 PM,2016,ExRedPill
7,Having trouble getting past the whole partner count thing,,WeiThroha,/r/ExRedPill,19/01/16 07:34 AM,2016,ExRedPill
6,Red pill boyfriend,,,/r/ExRedPill,21/09/16 05:29 PM,2016,ExRedPill
6,Low self esteem vs being realistic,,blackpillgirl,/r/ExRedPill,21/09/16 09:00 PM,2016,ExRedPill
6,"Made a new ""Post Red Pill"" forum for incels trying to improve. What do you think?",,RedInsideAllOver,/r/ExRedPill,01/09/16 02:12 AM,2016,ExRedPill
6,"I'm deeply paranoid about everything, especially women.",,6adfly,/r/ExRedPill,29/02/16 08:55 PM,2016,ExRedPill
6,How did you unsee TRP?,,,/r/ExRedPill,24/02/16 03:55 AM,2016,ExRedPill
5,To Men: Cruelty to the Inner Self,,,/r/ExRedPill,19/10/16 07:48 PM,2016,ExRedPill
5,The reason why TRP seems more sound than TBP,,tiposk,/r/ExRedPill,07/10/16 10:28 PM,2016,ExRedPill
5,The Red Pill resonates with me and I wish it didn't. Please help. Feeling depressed.,,,/r/ExRedPill,15/04/16 05:34 PM,2016,ExRedPill
5,Just wanted some advice,,ThrowMeOutInside,/r/ExRedPill,28/03/16 07:34 PM,2016,ExRedPill
4,Books on real female psychology,,ryandevil00,/r/ExRedPill,02/12/16 10:25 AM,2016,ExRedPill
4,Incel detox?,,MyRepIsRuined02,/r/ExRedPill,05/11/16 06:52 PM,2016,ExRedPill
4,How do I stop feeling that I am controlled and manipulated by women?,,throwaway79w-3494302,/r/ExRedPill,06/10/16 07:19 AM,2016,ExRedPill
4,"/r/OneY: Another useful, alternative perspective to Mensrights that not everyone knows about. [Why is this subreddit not already in the sidebar?]",,free-improvisation,/r/ExRedPill,22/01/16 07:23 PM,2016,ExRedPill
3,"Ex RP, tips to unlearn some RP things",,RPThrowaway2017,/r/ExRedPill,20/10/16 03:44 AM,2016,ExRedPill
3,Why Men Oppress Women,,,/r/ExRedPill,20/10/16 05:09 PM,2016,ExRedPill
3,I'm happy with this subreddit as long as nobody suggests TheBluePill is any better.,,trepers,/r/ExRedPill,18/08/16 07:54 AM,2016,ExRedPill
3,Query about specific bits of redpill,,mightbedumbquery,/r/ExRedPill,21/06/16 10:59 AM,2016,ExRedPill
3,"Had to ban myself from.Bluepill sub because considered sealioning, some harassment by individuals and didn't understand they were satirisng extremism with extremism. What now?",,Xemnas81,/r/ExRedPill,23/03/16 02:49 AM,2016,ExRedPill
3,"'Hypergamy is good for the species in the long term, even if it makes low-value men butthurt right now'. Do you agree with this statement?",,Xemnas81,/r/ExRedPill,18/03/16 02:15 AM,2016,ExRedPill
