Upvotes,Title,col_2,col_3,col_4,col_5,Year,Subreddit
3,How to stop hating women,,ugliestman1,/r/ExRedPill,27/02/19 11:02 PM,2019,ExRedPill
3,Can someone explain why this is wrong,,Athrowway123,/r/ExRedPill,16/02/19 08:47 PM,2019,ExRedPill
3,I am never going to be in a relationship red pill or not.,,thorisstillworthy,/r/ExRedPill,29/12/19 04:05 PM,2019,ExRedPill
3,How do you ladies and gentlemen address the open hypergamy culture?,,DREADC0RSAIR,/r/ExRedPill,20/08/19 12:24 AM,2019,ExRedPill
3,Question for exredpills and women:How do you deal with the fact that she will always be attracted to an alpha male(a very attractive male)?,,king_of_the_sting,/r/ExRedPill,06/01/19 02:11 AM,2019,ExRedPill
3,Thoughts on 'betaization' & 'shit tests'? True / False + Elaboration,,CarpetBurn12,/r/ExRedPill,22/12/19 11:21 AM,2019,ExRedPill
3,help me out with research!,,djf18,/r/ExRedPill,11/11/19 12:37 PM,2019,ExRedPill
3,This seems to be the most non redpill redpill video from a redpill guy.,,mosham126,/r/ExRedPill,22/07/19 02:33 PM,2019,ExRedPill
3,(Documentary) Inside The Secret World of Incels - BBC,,TeePeeDucks,/r/ExRedPill,19/07/19 11:11 AM,2019,ExRedPill
3,When did the red pill movement start?,,TeePeeDucks,/r/ExRedPill,07/07/19 04:42 AM,2019,ExRedPill
3,Red Pill Nihilism.,,LeadIntroMaster69,/r/ExRedPill,23/06/19 08:28 PM,2019,ExRedPill
3,I have been consuming red pill content for months and I can feel myself radicalizing. I need the other perspective.,,throwaway_dadvice,/r/ExRedPill,18/06/19 05:47 AM,2019,ExRedPill
3,Do you want help getting out of The Red Pill mentality?,,HairyAwareness,/r/ExRedPill,03/12/19 01:24 AM,2019,ExRedPill
3,How do I overcome my fear and negative outlook of women?,,e_Pluribus_Unum1,/r/ExRedPill,30/11/19 03:58 PM,2019,ExRedPill
2,Is there a healthy level of oneitis?,,mosham126,/r/ExRedPill,29/03/19 01:22 PM,2019,ExRedPill
2,Asian Women are the Worst : MGTOW,,StrongSecurity,/r/ExRedPill,03/04/19 08:29 PM,2019,ExRedPill
2,"What are your thoughts on ""The Manual: What Women Want and How to Give It to Them""?",,ThePreviousGod,/r/ExRedPill,24/03/19 11:42 PM,2019,ExRedPill
2,My loverbot malfunctioned .... why,,Urboy888,/r/ExRedPill,24/03/19 08:58 PM,2019,ExRedPill
2,Falling into the rabbit hole...,,black-serpent-dragon,/r/ExRedPill,01/03/19 10:27 AM,2019,ExRedPill
2,Slipping back to old beliefs.,,throwbonobo,/r/ExRedPill,28/02/19 08:13 AM,2019,ExRedPill
2,Why is there the rise of manosphere philosophy during recent times?,,TeePeeDucks,/r/ExRedPill,03/09/19 07:13 AM,2019,ExRedPill
2,Confusion,,TheShadowsVengeance,/r/ExRedPill,05/02/19 04:31 AM,2019,ExRedPill
2,What's the bluepill/ex-redpill view on LMR?,,Gackt,/r/ExRedPill,17/08/19 11:45 PM,2019,ExRedPill
2,Why do I keep getting attached to the girls I text from dating apps?,,bigflame123,/r/ExRedPill,12/08/19 11:51 PM,2019,ExRedPill
2,MGTOW BOYFRIEND,,RadicalREDPILLERZ,/r/ExRedPill,31/07/19 04:12 AM,2019,ExRedPill
2,Do I still have some TRP in me?,,PracticalProgress4,/r/ExRedPill,31/07/19 07:01 AM,2019,ExRedPill
2,Question about gender differences in breakups,,Randomposter260,/r/ExRedPill,29/07/19 01:12 AM,2019,ExRedPill
2,"So If the Red Pill is Toxic, what is the remedy for young men who feel disenfranchised by the American dating scene?",,IndigenousNeo,/r/ExRedPill,19/07/19 08:37 AM,2019,ExRedPill
2,What were some positive aspects of TRP you were able to take away?,,APCSOAD,/r/ExRedPill,19/12/19 08:35 PM,2019,ExRedPill
2,How is r/Redpill wrong?,,NoPickleLeftBehind,/r/ExRedPill,07/07/19 12:49 AM,2019,ExRedPill
2,"Talking to a girl, afraid I'm moving too slow.",,iiOgetsu,/r/ExRedPill,21/06/19 03:15 PM,2019,ExRedPill
2,[Text Dump] Ex MGTOW looking for answers,,animeweeb33,/r/ExRedPill,04/09/19 05:03 AM,2019,ExRedPill
2,The pestering plate,,katiefizzle,/r/ExRedPill,25/11/19 08:11 AM,2019,ExRedPill
2,Escaping the red pill is near impossible when society shows you exactly what you were fearing the most,,seekerofdarkness73,/r/ExRedPill,22/11/19 10:29 PM,2019,ExRedPill
2,Any comments on this essay?,,Redditredditr260,/r/ExRedPill,20/05/19 06:19 AM,2019,ExRedPill
2,Im starting to realize gender rolls are my problem not dating or lack of it itslef. ( boy still live with 1950s expectations and girls are allowed to live in 2019 expectations),,defo18,/r/ExRedPill,20/11/19 08:10 PM,2019,ExRedPill
2,Can someone please help me accept this??,,BullishScentedCandle,/r/ExRedPill,03/05/19 05:00 PM,2019,ExRedPill
1,Is it me or is almost always a bad idea to tel a girl you like her?,,bigflame123,/r/ExRedPill,05/11/19 12:08 PM,2019,ExRedPill
1,What do you think about chaste in both genders?,,Incinaknick,/r/ExRedPill,25/04/19 11:58 AM,2019,ExRedPill
1,For women relationships are about manipulating your parner into an obidient slave,,NamasteFelicia,/r/ExRedPill,02/11/19 11:58 AM,2019,ExRedPill
1,Real Social Dynamics is Another Name for The Red Pill,,WonderfulDorothyOfOz,/r/ExRedPill,31/10/19 09:57 PM,2019,ExRedPill
1,"""Don't get hurt""",,PhauxeFox,/r/ExRedPill,31/10/19 12:56 AM,2019,ExRedPill
1,I like this girl who is older and more mature than me,,MeditatingParadise,/r/ExRedPill,30/10/19 02:27 PM,2019,ExRedPill
1,I have a friend who I think is going down the redpill rabbit hole. What do I do?,,cyka_blyat356,/r/ExRedPill,15/04/19 07:54 AM,2019,ExRedPill
1,How can I recondition myself and learn to trust.,,SeriousProfit,/r/ExRedPill,14/10/19 06:53 AM,2019,ExRedPill
1,Something to think about next time you're consuming any sort of fringe group content. (excerpt from a longer piece I'm working on),,Trustedflipper8,/r/ExRedPill,10/10/19 06:12 PM,2019,ExRedPill
1,Red Pill Alternative,,itsben1999,/r/ExRedPill,26/04/19 04:26 PM,2019,ExRedPill
1,"""Ex-redpillers"" what is your understanding of what it is to be an alpha?",,mosham126,/r/ExRedPill,03/04/19 03:21 PM,2019,ExRedPill
1,EVERYONE IS WELCOME TO JOIN US.,,AnswerTRP,/r/ExRedPill,01/04/19 04:09 PM,2019,ExRedPill
1,How do I tell my wife about the affair,,ScottMcott,/r/ExRedPill,09/11/19 10:13 PM,2019,ExRedPill
1,Why I think the Symbol for ex Red Pill should be the spoon.,,Vive-lamour,/r/ExRedPill,03/10/19 10:43 AM,2019,ExRedPill
1,Recovering MGTOW here (CrossPost),,ENTP_AnarchoEgoist,/r/ExRedPill,06/04/19 12:58 AM,2019,ExRedPill
1,Jordan peterson on hypergamy,,35menery35,/r/ExRedPill,23/03/19 05:43 PM,2019,ExRedPill
1,Rare Song on Domestic Violence against Men... What do you think of this?,,heyjaintlemen,/r/ExRedPill,22/03/19 08:37 PM,2019,ExRedPill
1,Rhonda Laine and the big cult ass whip by church of Jeahovas and church of Scientology,,rhon2,/r/ExRedPill,20/03/19 07:48 PM,2019,ExRedPill
1,dealing with my fractured capability to trust,,SilverBerserker,/r/ExRedPill,30/09/19 09:24 AM,2019,ExRedPill
1,Eastern European Men School,,Adam1stperson,/r/ExRedPill,27/09/19 11:31 AM,2019,ExRedPill
1,RedPill's popularity is showing the unresolved the childhood emotional and developmental traumas on a societal level,,TeePeeDucks,/r/ExRedPill,21/09/19 01:52 PM,2019,ExRedPill
1,How can I overcome my jealousy so it stops ruining my relationships?,,BullishScentedCandle,/r/ExRedPill,20/09/19 06:39 PM,2019,ExRedPill
1,For Estonia! Fight the Black and Red pilled armies!,,Croat8753,/r/ExRedPill,31/01/19 04:35 PM,2019,ExRedPill
1,Remove MGTOW FROM THE PREMISE YOU ARE WORST TURK RETURN TO CROATIA YOU MAY CUM OUR COUNTRY REMOVE ROOSH V REMOVE JORDAN PETERSON ROOSH BANNED FROM PAY PAL BEST DAY OF MY LIFE RUSSIA+USA+SLOVAKI+SERBIA = REMOVE MANOSHPERE BOSNIA,,Croat8753,/r/ExRedPill,26/01/19 02:01 AM,2019,ExRedPill
1,What can be done about the Black Pill Crisis?,,trustyoursources,/r/ExRedPill,22/01/19 06:15 PM,2019,ExRedPill
1,From the Redpill what exactly is useful for Long term Relationship?,,Rhyat250,/r/ExRedPill,02/02/19 11:11 PM,2019,ExRedPill
1,What are the signs that someone is a redpiller irl?,,throwaway4439239,/r/ExRedPill,25/08/19 12:29 AM,2019,ExRedPill
1,Fear woman because of their nature,,BagelClose,/r/ExRedPill,24/08/19 10:43 PM,2019,ExRedPill
1,Hyena or a case of galloping schizophrenia ;-),,marilino2,/r/ExRedPill,30/12/19 04:20 PM,2019,ExRedPill
1,The Red Pill made me mentally ill ( serious post),,Croat8753,/r/ExRedPill,24/01/19 01:52 PM,2019,ExRedPill
1,Crossposted from this sub. Ex RP for over a year but want perspectives from people similar to me,,ngliahg,/r/ExRedPill,19/12/19 06:56 AM,2019,ExRedPill
1,The Hidden Weapon of The Red Pill Men: The Silent Treatment,,WonderfulDorothyOfOz,/r/ExRedPill,16/12/19 01:16 AM,2019,ExRedPill
1,How to ask out a girl I like,,Damichia,/r/ExRedPill,13/08/19 03:00 AM,2019,ExRedPill
1,Going to make a post later about my red pill journey and why it ruined me. Is there a place where I can start detox?,,SorryBelt,/r/ExRedPill,04/01/19 12:56 AM,2019,ExRedPill
1,Last night was crazy as fuck,,FatherofDamn,/r/ExRedPill,10/08/19 06:44 PM,2019,ExRedPill
1,Musings on Toxic Masculinity,,SnapagatortheCroc,/r/ExRedPill,26/11/19 09:39 PM,2019,ExRedPill
1,Musing on ‘Toxic Masculinity’,,SnapagatortheCroc,/r/ExRedPill,26/11/19 10:01 PM,2019,ExRedPill
1,Do I still have some TRP in me?,,thetzimisce,/r/ExRedPill,31/07/19 07:01 AM,2019,ExRedPill
1,"Am I still a ""Nice Guy""? I'd thought I'd gotten over it but someone has suggested that I still am",,thrandom_rowaway,/r/ExRedPill,25/07/19 07:32 AM,2019,ExRedPill
1,"Main victim here is YOUTUBE ALGORITHM, Putting us into a RP rabbit hole.",,mogambo9,/r/ExRedPill,04/11/19 05:10 PM,2019,ExRedPill
1,How do I stop over analyzing everything my girlfriend of a year does or doesnt do?,,0264831,/r/ExRedPill,19/12/19 03:06 AM,2019,ExRedPill
1,Trust issues,,bottleups,/r/ExRedPill,19/12/19 12:27 AM,2019,ExRedPill
1,Beta or codependent?,,Leloux_VII,/r/ExRedPill,08/07/19 07:31 AM,2019,ExRedPill
1,why its hard to get out of the red pill,,SHAKIRAISHOT,/r/ExRedPill,06/07/19 08:13 PM,2019,ExRedPill
1,why its hard to give up the red pill,,SHAKIRAISHOT,/r/ExRedPill,06/07/19 08:14 PM,2019,ExRedPill
1,"I know the red pill is degenerate but you guys here at and the Good men project are perfect examples of the ""beautiful ones""",,goodmanprojectcucks,/r/ExRedPill,08/10/19 03:04 AM,2019,ExRedPill
1,Is this true?,,yumyumonhead,/r/ExRedPill,01/07/19 10:46 AM,2019,ExRedPill
1,Thoughts on this video?,,Larshermanb,/r/ExRedPill,30/06/19 07:48 AM,2019,ExRedPill
1,What are the the bad or even word advice from the redpill?,,eddie_boy_201,/r/ExRedPill,02/10/19 01:03 AM,2019,ExRedPill
1,I can't fall in love with girls anymore,,DC239,/r/ExRedPill,14/12/19 06:42 PM,2019,ExRedPill
1,"IF anyone sees stikcers like this on campus desks or in boys bath rooms, where they are popping up mostly please take them down. They are trying to paint all woman with one brush. It's incel trash.",,littleBIGAPenny,/r/ExRedPill,03/11/19 05:51 PM,2019,ExRedPill
1,Fallacies in Red Pill (Part I) - The Biological Determinism Fallacy,,WonderfulDorothyOfOz,/r/ExRedPill,13/12/19 06:20 PM,2019,ExRedPill
1,There are 2 guys (High SMV and Infidelity),,depressedjoecz,/r/ExRedPill,08/12/19 11:13 AM,2019,ExRedPill
1,"Finding the right person will make you forget about Red Pill, Feminism, and MGTOW",,cinfuller,/r/ExRedPill,05/12/19 08:23 PM,2019,ExRedPill
1,"I was thinking deeply about my experience with the international neofascist movement and I want to help people. I want to start a YouTube channel and I think I finally understood the psychology of being a fascist. If you want to share your story please do it, I really want to expand my perspective.",,alkonyi,/r/ExRedPill,26/11/19 01:17 PM,2019,ExRedPill
1,"I used to believe in genetic determism that good looks, height, intelligence, brain size, athlecism is genetically determined.",,tedrahedron,/r/ExRedPill,25/11/19 12:48 AM,2019,ExRedPill
1,The remnants of redpill have exacerbated my trust issues. How can I trust my girlfriend when everything I’ve learned says not to?,,yeeticus1996,/r/ExRedPill,05/12/19 10:03 AM,2019,ExRedPill
1,Difficult to get along with redpill boyfriend,,throwra2952,/r/ExRedPill,22/11/19 05:38 AM,2019,ExRedPill
1,haha,,ivan_mcnasty,/r/ExRedPill,30/08/19 08:24 PM,2019,ExRedPill
1,haha,,ivan_mcnasty,/r/ExRedPill,30/08/19 07:59 PM,2019,ExRedPill
1,How to Cold Approach Attractive Women Easily,,jetli12345,/r/ExRedPill,27/06/19 09:33 PM,2019,ExRedPill
1,How To Get Over Heartbreak In A Healthy Way,,theasianplayboy,/r/ExRedPill,25/06/19 10:29 PM,2019,ExRedPill
1,If woman want to reproduce alphas why are we not all born of alpha fathers?,,total_sleezeball,/r/ExRedPill,09/11/19 09:40 PM,2019,ExRedPill
1,Single mom fuck buddy doesn’t want to use birth control and doesn’t believe in abortion?,,bigflame123,/r/ExRedPill,29/04/19 02:17 AM,2019,ExRedPill
0,Your Sub is Ass,,EL_Miore,/r/ExRedPill,08/01/19 12:38 AM,2019,ExRedPill
0,"From asktrp - ""asked_girl_to_come_over_and_watch_netflix_and_she""",,alcockell,/r/ExRedPill,29/04/19 03:33 PM,2019,ExRedPill
0,The bro code and happiness inequality between genders,,timmy0112,/r/ExRedPill,03/11/19 04:35 PM,2019,ExRedPill
0,Some thoughts I have,,Exredpill123,/r/ExRedPill,23/04/19 04:11 PM,2019,ExRedPill
0,Why no Jordan Peterson?,,Postmodernrobot,/r/ExRedPill,18/04/19 11:21 PM,2019,ExRedPill
0,"I never paid attention to these stickers before on campus. I dont understand redpillers need to post stickers. Dont we have enough incels, why do you need to creat more.",,littleBIGAPenny,/r/ExRedPill,02/11/19 04:55 PM,2019,ExRedPill
0,Overcoming redpill rage,,angry-white-man,/r/ExRedPill,16/04/19 04:10 AM,2019,ExRedPill
0,questions,,SHAKIRAISHOT,/r/ExRedPill,12/04/19 01:41 PM,2019,ExRedPill
0,"Normalising single motherhood is a symptom. However, it is not the sole problem in itself.",,pandamojia,/r/ExRedPill,10/04/19 09:41 AM,2019,ExRedPill
0,"Imagine you're on a Jumbo Jet airplane and suddenly all the engines stop working, what happens next? Well ....",,AriAsulin,/r/ExRedPill,06/04/19 04:59 PM,2019,ExRedPill
0,Imprinting women is legit?,,allen_hernandez1,/r/ExRedPill,03/10/19 06:36 PM,2019,ExRedPill
0,"My thoughts, story, views, and struggle as a 6'8 person",,Danny_RD,/r/ExRedPill,03/10/19 10:04 PM,2019,ExRedPill
0,Are there any modest and traditional women left?,,Kotasuoa,/r/ExRedPill,18/03/19 07:08 AM,2019,ExRedPill
0,Cheating wife gets exposed and gets pregnant by another man,,mgtowmasters,/r/ExRedPill,24/12/19 05:20 PM,2019,ExRedPill
0,I've spent 2 years digesting the retarded redpill and now i'm dealing with the 4th prosecution against me,,someonesopinion6969,/r/ExRedPill,13/03/19 05:35 PM,2019,ExRedPill
0,Do you feel like you're competing with your partner's mobile phone for attention?,,12Princess110411,/r/ExRedPill,22/09/19 03:13 AM,2019,ExRedPill
0,Please rate my face. 1 to 10,,defo18,/r/ExRedPill,25/12/19 02:48 AM,2019,ExRedPill
0,There is no point to dating unless you have male model looks,,ugliestman1,/r/ExRedPill,03/03/19 10:46 PM,2019,ExRedPill
0,Field Report/Technical Breakdown(Girl next door cute German girl(You don't need to approach 1000 girls),,Kratz177,/r/ExRedPill,13/09/19 04:48 PM,2019,ExRedPill
0,How to ask a girl straight-up that I want to feel her breast without creeping her out,,FootballRebel,/r/ExRedPill,03/09/19 12:46 AM,2019,ExRedPill
0,The original red pill.,,ClassPunk,/r/ExRedPill,13/02/19 06:58 PM,2019,ExRedPill
0,Losers.,,The-Wizard-of-Oz-,/r/ExRedPill,05/09/19 09:53 AM,2019,ExRedPill
0,My reflection on last night,,StabBack07,/r/ExRedPill,25/08/19 01:39 AM,2019,ExRedPill
0,You're Not Learning,,Chai_Skiffton,/r/ExRedPill,25/01/19 11:55 PM,2019,ExRedPill
0,"For people that arent redpill, you all sure do seem to talk about redpill alot",,DREADC0RSAIR,/r/ExRedPill,20/08/19 04:36 PM,2019,ExRedPill
0,The Red Pill has ruined my life. INTRO PART 1,,Croat8753,/r/ExRedPill,23/01/19 06:07 PM,2019,ExRedPill
0,I lost my dreams to the Red Pill. PART 1,,Croat8753,/r/ExRedPill,23/01/19 07:23 PM,2019,ExRedPill
0,"PART 2 "" The Start of Decay""",,Croat8753,/r/ExRedPill,23/01/19 08:04 PM,2019,ExRedPill
0,I think both are right.,,Calcornell,/r/ExRedPill,20/01/19 11:26 PM,2019,ExRedPill
0,Why are woman so scared,,StabBack07,/r/ExRedPill,15/08/19 11:14 PM,2019,ExRedPill
0,I feel that my inability to be friends with women is the main reason I’m not getting into a relationship or even having casual sex?,,bigflame123,/r/ExRedPill,14/08/19 02:45 AM,2019,ExRedPill
0,"Prove that ""not a bad boy = not wet"" and ""relationships doesnt work"" ideas are wrong",,kanteroalberda,/r/ExRedPill,07/01/19 05:33 PM,2019,ExRedPill
0,"Why is TRP ""toxic""",,EL_Miore,/r/ExRedPill,05/01/19 11:11 PM,2019,ExRedPill
0,Working with women has become an issue for some men these days with harassment charges becoming so all-encompassing. What do you think?,,ssangel,/r/ExRedPill,04/01/19 01:26 PM,2019,ExRedPill
0,Self-reflection and feelings,,StevenDouglas09,/r/ExRedPill,11/08/19 05:56 AM,2019,ExRedPill
0,How do i stop getting mad at rejection?,,JustinMoarles,/r/ExRedPill,09/08/19 04:53 AM,2019,ExRedPill
0,I hate my parents,,JustinMoarles,/r/ExRedPill,09/08/19 05:16 AM,2019,ExRedPill
0,This is why I hate women,,JustinMoarles,/r/ExRedPill,09/08/19 05:34 AM,2019,ExRedPill
0,I fucking hate woman,,JustinMoarles,/r/ExRedPill,09/08/19 05:44 AM,2019,ExRedPill
0,Saw two hot woman got mad,,JustinMoarles,/r/ExRedPill,09/08/19 06:00 AM,2019,ExRedPill
0,My life change for me last night,,SonofDamn,/r/ExRedPill,09/08/19 07:21 PM,2019,ExRedPill
0,My only way of self-improvement without red pill,,ItHogDawg27,/r/ExRedPill,06/08/19 04:22 AM,2019,ExRedPill
0,How do I deal with my crush,,JustinMoarles,/r/ExRedPill,06/08/19 10:41 PM,2019,ExRedPill
0,check on your date's credit score when going on a date,,AndyRobinsonSAAS,/r/ExRedPill,05/11/19 01:33 PM,2019,ExRedPill
0,Please suggess some non- gynocentric movies/shows!!,,themanipulator1992,/r/ExRedPill,05/07/19 07:08 AM,2019,ExRedPill
0,"Am I a new type of ""pill""?",,Cash50000,/r/ExRedPill,03/07/19 01:28 AM,2019,ExRedPill
0,Red-pill antithesis,,bright-morningstar,/r/ExRedPill,23/06/19 05:21 PM,2019,ExRedPill
0,The BlackPill turned me into a psychopath,,TheBlackPillFuckedMe,/r/ExRedPill,13/12/19 11:45 AM,2019,ExRedPill
0,I just got bashed by this subreddit all day yesterday.,,thorisstillworthy,/r/ExRedPill,30/12/19 12:13 PM,2019,ExRedPill
0,"I tried picking up a girl, while filming the entire thing",,HUR9191,/r/ExRedPill,01/09/19 05:16 PM,2019,ExRedPill
0,"Oh so reddit is on the same side as other anti ""hate speech"" platforms?",,nietaknie,/r/ExRedPill,18/06/19 05:44 PM,2019,ExRedPill
0,How does one remain exredpill?,,IAmWolph,/r/ExRedPill,18/06/19 07:13 PM,2019,ExRedPill
0,CMV: Hypergamy is real and active,,RoninCDN,/r/ExRedPill,16/06/19 07:15 AM,2019,ExRedPill
0,I just left the board because of a mod,,artistacat,/r/ExRedPill,20/12/19 09:44 AM,2019,ExRedPill
525,Red Pill Detox First Aid Kit - Start Here!,,RedPillDetox,/r/ExRedPill,09/07/20 04:47 PM,2020,ExRedPill
344,Next time you start think of women as sluts or whores...,,zoemondo,/r/ExRedPill,25/08/20 07:44 PM,2020,ExRedPill
330,"80/20 is bullshit, women don’t have high standards, they aren’t that different from us, and they don’t care about anything TRP or PUA want you to think they do",,imbecile_keshig,/r/ExRedPill,14/07/20 09:24 AM,2020,ExRedPill
330,To incel/MGTOW lurkers: I found the way out,,throwRA2829,/r/ExRedPill,07/05/20 07:34 PM,2020,ExRedPill
241,4 years ago I found the red pill and it warped my perception of women. I’m here to warn other young men.,,cozyknickers,/r/ExRedPill,08/01/20 01:34 AM,2020,ExRedPill
221,Thoughts from a woman who once had a red pill mentality,,willow_tangerine,/r/ExRedPill,30/03/20 10:53 PM,2020,ExRedPill
162,"Just a reminder to anyone who hates women: Remember that men are equally as capable of betraying, lying, and stealing from you. Don't be on ""team men"" or ""team women."" Both genders can hurt you. One isn't better or worse than the other. (Story of how my best friend tried to sleep with my girl)",,CanadianTurt1e,/r/ExRedPill,11/06/20 04:44 AM,2020,ExRedPill
152,True Connection with a Human Being,,Graineon,/r/ExRedPill,07/07/20 10:19 PM,2020,ExRedPill
147,All red pill taught me was to hate women and I couldn't live with the constant negativity in my life.,,,/r/ExRedPill,18/07/20 04:46 PM,2020,ExRedPill
142,Being ugly doesn’t give you an excuse to hate women,,throwRA2829,/r/ExRedPill,09/05/20 10:32 PM,2020,ExRedPill
137,All these redpill vids I used to watch and never once saw a guy blame himself for his relationship problems.,,AUfan36,/r/ExRedPill,30/06/20 07:02 AM,2020,ExRedPill
128,What red pillers and mgtow guys really look like,,Nightlife811,/r/ExRedPill,17/08/20 06:43 PM,2020,ExRedPill
124,I'm an Ex-MGTOW member,,Lick-My-Nipples,/r/ExRedPill,31/08/20 01:15 PM,2020,ExRedPill
124,Why am I listening to what red pill guys have to say when I've never even had a girlfriend? LOL,,StopBullyingIncels,/r/ExRedPill,30/07/20 10:09 PM,2020,ExRedPill
124,Reminder: Just because you've had some fucked up experience doesn't mean you need to go Red Pill,,RedPillDetox,/r/ExRedPill,09/10/20 11:57 PM,2020,ExRedPill
122,"ExRedPill has fallen down a bit, but hear me out.",,HeartbreakHotline,/r/ExRedPill,05/07/20 08:31 PM,2020,ExRedPill
120,There are men who follow red pill ideologies who think they're strong for being emotionally unavailable but they're actually really weak.,,CharlesManson_exe,/r/ExRedPill,24/05/20 02:32 PM,2020,ExRedPill
114,"It's a hate training, nothing less",,EverybodyIsMyBro,/r/ExRedPill,01/05/20 12:58 PM,2020,ExRedPill
111,The Red Pill - The Incredible Damage It Has Done To My Life,,Supersubie,/r/ExRedPill,27/03/20 01:58 PM,2020,ExRedPill
111,"If Redpill is still convincing to you, despite all reason and evidence to the contrary...",,zoemondo,/r/ExRedPill,02/09/20 05:36 PM,2020,ExRedPill
108,The terms Alpha Male and Beta Male in regards to dating originally come from a small segment of a book writen in 2007 by a batshit-insane ex-biologist looser who never had any proven sucess in life. He was comparing humans to gorillas. (LONG READ).,,CountVP,/r/ExRedPill,13/06/20 12:52 AM,2020,ExRedPill
107,Being a successful PUA isn't worth it,,Cosmoglio,/r/ExRedPill,14/09/20 08:41 PM,2020,ExRedPill
107,Red pill guys criticizing women for doing hookups,,AUfan36,/r/ExRedPill,12/07/20 03:20 AM,2020,ExRedPill
106,Why I left the mgtow movement,,zakmo96,/r/ExRedPill,01/03/20 12:05 PM,2020,ExRedPill
102,"The red pill constantly cherry pick clips of women freaking out and say ""HaHa MeMe GeNdEr! ThEy ArE cHiLdReN!"" Here's a gif of a man in his thirties who plays video games for a living and throws his controller when he loses. ManChilds are real too.",,StopBullyingIncels,/r/ExRedPill,31/07/20 11:49 AM,2020,ExRedPill
100,I'm 15 and I'm glad I never got fully invested into the red pill,,gmc_nxtman,/r/ExRedPill,10/08/20 06:06 PM,2020,ExRedPill
99,These red pill content creators are hilarious,,512fm,/r/ExRedPill,04/08/20 09:36 AM,2020,ExRedPill
99,"I used to date a Red pill guy - untill he dumped me for being ""too serious"" and ""wanting a family"" (Directly disproving everything they preach)",,_Crazy_Luck_,/r/ExRedPill,27/04/20 02:21 AM,2020,ExRedPill
97,"[CMV] If you're a red pill man sold on ""female nature"" you're very inexperienced in life and dating",,TrollinTRP,/r/ExRedPill,28/08/20 07:50 PM,2020,ExRedPill
96,People tend to Date at their Station...Red Pill is attractive to people because it makes excuses for their own failings,,mc0079,/r/ExRedPill,10/09/20 03:41 PM,2020,ExRedPill
94,I wasn't left for Chad,,Midwesthermit,/r/ExRedPill,14/04/20 05:45 PM,2020,ExRedPill
94,The cognitive dissonance of MGTOW,,the_C_Atheist,/r/ExRedPill,07/11/20 02:58 AM,2020,ExRedPill
94,Don't MGTOWs realise that sexism creates shithole countries?,,Baghdadincoming,/r/ExRedPill,08/04/20 02:41 PM,2020,ExRedPill
92,Confessions of a Former Misogynist: My Descent into the MGTOW Pipeline,,ENTP_AnarchoEgoist,/r/ExRedPill,12/01/20 09:36 PM,2020,ExRedPill
89,Self-proclaimed “Alpha Male” brags about how great he is at getting sex from barely legal 18 year old girls. Turns out he’s a 25 year old virgin. Is anyone surprised?,,Caliph_of_Cairo,/r/ExRedPill,25/10/20 07:21 AM,2020,ExRedPill
88,Oop,,smirt999,/r/ExRedPill,29/12/20 04:12 PM,2020,ExRedPill
88,You all need to watch/rewatch Disney's Hunchback of Notre Dame.,,Stargazer1919,/r/ExRedPill,08/08/20 07:19 PM,2020,ExRedPill
87,"""I'm a feminist"", I said two nights ago for the first time. And it wasn't weird.",,iama-canadian-ehma,/r/ExRedPill,17/01/20 03:44 PM,2020,ExRedPill
87,Obsession with women,,ZealousidealFig5,/r/ExRedPill,11/08/20 05:39 PM,2020,ExRedPill
87,"The anime/manga known as ""ERASED"" is what single-handedly got me out of the toxic RedPiller mentality. I know this sounds ridiculous, but you have to hear me out.",,CanadianTurt1e,/r/ExRedPill,06/06/20 04:40 AM,2020,ExRedPill
87,MGTOW makes me sad,,redbastie,/r/ExRedPill,13/07/20 06:57 PM,2020,ExRedPill
87,Is this the support group?,,MommysPills,/r/ExRedPill,17/07/20 11:29 PM,2020,ExRedPill
86,Red Pill denies an important truth - we men want closeness with women,,Planetof12,/r/ExRedPill,19/12/20 04:48 PM,2020,ExRedPill
86,how mgotw and redpill made me fearful of women and how I got out.,,ilreverde,/r/ExRedPill,24/04/20 04:27 PM,2020,ExRedPill
86,TRPs cult like terminology for women.,,spacechicken1990,/r/ExRedPill,16/07/20 10:05 AM,2020,ExRedPill
84,"The Ultimate Goal of MRAs, MGTOW and TRP",,NdN124,/r/ExRedPill,04/10/20 09:52 PM,2020,ExRedPill
84,After reading the book Secrets of a Passionate Marriage I realized one major flaw with red pill,,diceblue,/r/ExRedPill,26/11/20 01:45 AM,2020,ExRedPill
83,"As someone who's never been a part of or followed ""the red pill"", I find the redpill sub-reddit(s) scream of insecurity, trying to over compensate, and just trying to seek approval / attention.",,Pete26l96,/r/ExRedPill,26/02/20 09:08 PM,2020,ExRedPill
83,Just wanna say thank you exredpill,,Half-Ice-Half-Fire,/r/ExRedPill,27/08/20 12:59 AM,2020,ExRedPill
