Upvotes,Title,col_2,col_3,col_4,col_5,Year,Subreddit
15,Update post about autism and the red pill,,Darkorigins7323,/r/ExRedPill,20/07/23 12:58 AM,2023,ExRedPill
15,Is 26 too late to find love/relationship?,,icausepain_,/r/ExRedPill,05/02/23 11:05 AM,2023,ExRedPill
15,List of redpill/Blackpill content creators?,,Brilliant_Program_39,/r/ExRedPill,06/12/23 08:45 PM,2023,ExRedPill
15,People say male privledge doesn't exist what are privledges males have that females don't in society? (List in bullet points),,Valuable-Emergency27,/r/ExRedPill,20/03/23 06:49 PM,2023,ExRedPill
15,Narcissistic abuse,,kwanthony1986,/r/ExRedPill,18/01/23 11:42 PM,2023,ExRedPill
15,why so many redpills are atheists?,,galkaocznaa,/r/ExRedPill,02/03/23 10:28 PM,2023,ExRedPill
15,Exredpill research project,,Researcher_HopeUni,/r/ExRedPill,25/08/23 01:17 PM,2023,ExRedPill
15,"How important are looks, money and status for making friends, garnering respect and finding a meaningful relationship?",,Bumly1998,/r/ExRedPill,11/05/23 02:30 PM,2023,ExRedPill
15,Struggling with red pill mentality after getting cheated on.,,Ok-Engineering186,/r/ExRedPill,30/05/23 06:04 PM,2023,ExRedPill
15,RP claims women live life on easy mode,,Nappy_Ty,/r/ExRedPill,15/07/23 10:30 PM,2023,ExRedPill
15,What are your main problem’s with the red pill?,,Ok_Cryptographer6856,/r/ExRedPill,11/01/23 10:23 PM,2023,ExRedPill
15,Angry and Sad,,imullyn,/r/ExRedPill,04/05/23 08:07 AM,2023,ExRedPill
15,"Why do women really get approached so much by men, online and irl?",,willstdumichstressen,/r/ExRedPill,01/02/23 10:21 PM,2023,ExRedPill
15,Almost Baited Back Into RP Thinking,,Old-Vermicelli1951,/r/ExRedPill,29/03/23 09:43 AM,2023,ExRedPill
15,"Research shows men feel as lonely as men despite reporting more friends than men, what do you think is the reason behind this discrepancy?",,DetermineAssurance,/r/ExRedPill,16/02/23 02:11 PM,2023,ExRedPill
15,When's the last time you heard something positive?,,prolific1997,/r/ExRedPill,27/04/23 05:09 AM,2023,ExRedPill
15,The irony of the redpill,,lordDandas,/r/ExRedPill,25/04/23 10:13 AM,2023,ExRedPill
15,Hamza and his untreated OCD,,hecklerof,/r/ExRedPill,08/10/23 03:47 PM,2023,ExRedPill
15,Venting,,VariationArtistic518,/r/ExRedPill,26/10/23 09:19 PM,2023,ExRedPill
15,A Contradiction Occurred to Me,,RealRussShackleford,/r/ExRedPill,11/02/23 07:48 PM,2023,ExRedPill
15,"One thing I don’t understand about these podcasts (F&F, just pearly things and etc) is… they’ll ask women their personal opinion on something or their experiences.. but the hosts will call them liars or delusional.",,Sparklingfairy_,/r/ExRedPill,11/02/23 06:16 PM,2023,ExRedPill
15,"Men who left Red Pill, did you ever go back and apologize to the ones you hurt? What did you do instead if not?",,ShelbySecretary,/r/ExRedPill,05/05/23 02:16 PM,2023,ExRedPill
15,"Red Pill made me think that Im not ""good enough""",,icausepain_,/r/ExRedPill,14/02/23 11:24 AM,2023,ExRedPill
15,I am crying because I am not getting women. Do you think my BBD is related to lack of women? I was feed too much red pill crap.,,Fantastic-Whole-1830,/r/ExRedPill,19/03/23 09:23 PM,2023,ExRedPill
14,F&F demonetized on YT,,6stringfella,/r/ExRedPill,22/08/23 06:04 PM,2023,ExRedPill
14,What are your favorite content creators that disprove redpill propaganda?,,CptHappyOrange,/r/ExRedPill,17/04/23 02:19 AM,2023,ExRedPill
14,How to stop myself from falling into redpill ideology.,,No_Lingonberry6101,/r/ExRedPill,04/10/23 01:44 AM,2023,ExRedPill
14,My biggest problem with redpill & blackpill,,Lemon-Aid917,/r/ExRedPill,27/10/23 09:24 PM,2023,ExRedPill
14,Do you guys think that lust is huge problem for men?,,Pension-North,/r/ExRedPill,09/07/23 04:37 AM,2023,ExRedPill
14,My counselor is a moron! I agree with everyone.,,Darkorigins7323,/r/ExRedPill,22/07/23 06:44 AM,2023,ExRedPill
14,Ex-RP what was the most difficult part about being RP?,,allthepillsthatutake,/r/ExRedPill,18/06/23 07:40 PM,2023,ExRedPill
14,No eggs???,,Admirable_Bid_9193,/r/ExRedPill,23/12/23 10:45 PM,2023,ExRedPill
294,"As a man, I fucking hate the so-called ""men's rights"" movement. It can burn in hell",,sinodauce131,/r/ExRedPill,22/11/24 09:40 PM,2024,ExRedPill
195,"What red pillers get wrong about the ""girls love bad boys"" trope",,meleyys,/r/ExRedPill,16/12/24 07:53 PM,2024,ExRedPill
182,The Red Pill is dying,,Hopeful-Produce-5940,/r/ExRedPill,10/07/24 03:53 AM,2024,ExRedPill
162,The redpill idea of relationships are so toxic and miserable,,Wild-Judgment-404,/r/ExRedPill,21/08/24 01:13 PM,2024,ExRedPill
159,"I don't believe that ""every woman sleeps with chads""",,Top-Mechanic-5494,/r/ExRedPill,28/07/24 10:33 PM,2024,ExRedPill
142,Red pill hypocrisy and circular logic,,Schmutzcityusa,/r/ExRedPill,02/02/24 12:04 AM,2024,ExRedPill
140,I am a woman and RP makes dating men impossible for me.,,amyilas,/r/ExRedPill,12/11/24 09:41 AM,2024,ExRedPill
138,I would travel the world with a 1/10 Girl and be happier than 99% of Red Pillers.,,Hexo_Gen,/r/ExRedPill,03/01/24 04:47 PM,2024,ExRedPill
138,Why do redpill men hate women they don't want to be with anyway?,,Top-Mechanic-5494,/r/ExRedPill,22/09/24 10:37 PM,2024,ExRedPill
134,Why women don't have sex on day one,,Solarom,/r/ExRedPill,30/07/24 10:08 AM,2024,ExRedPill
131,I used to be friends with a dude who hated woman and got laid a ton.,,Reddituser8018,/r/ExRedPill,24/05/24 09:45 AM,2024,ExRedPill
128,What do you guys think about Sadia Khan?,,Environmental-Owl958,/r/ExRedPill,28/06/24 11:53 AM,2024,ExRedPill
125,"The claim is not ""women have a magical misogyny detector."" The claim is ""misogynistic men who have trouble getting dates are often bad at hiding their misogyny.""",,meleyys,/r/ExRedPill,26/04/24 09:06 PM,2024,ExRedPill
123,A cautionary tale for passport bros,,RevolutionaryPin9709,/r/ExRedPill,02/12/24 02:19 AM,2024,ExRedPill
122,Women like me now,,ProfessorRocks,/r/ExRedPill,27/02/24 11:35 AM,2024,ExRedPill
122,I made friends with girls and I love it.,,16townsendja,/r/ExRedPill,10/02/24 06:33 AM,2024,ExRedPill
112,The Redpill Gurus Have Valuable Advice,,Designer-Arugula6796,/r/ExRedPill,03/04/24 06:00 AM,2024,ExRedPill
111,"I keep seeing the sentiment on this subreddit that ""women are taught they have inherent value, men are taught they must earn their value."" This is bullshit.",,meleyys,/r/ExRedPill,12/04/24 06:57 PM,2024,ExRedPill
104,They literally start to whine when they see a smart women,,BLANC_Luca,/r/ExRedPill,07/05/24 04:24 PM,2024,ExRedPill
102,"I was never redpill, but the red pill women subreddit confuses me",,BernardoKastrupFan,/r/ExRedPill,23/12/24 06:55 AM,2024,ExRedPill
92,I think I finally get it and decided (rant) that I don’t want to be an “above average high value masculine man” (what ever the fuck that means),,Possible-Shift249,/r/ExRedPill,02/01/24 04:03 AM,2024,ExRedPill
91,The biggest red pill contradiction about women’s happiness,,underwater_flying,/r/ExRedPill,05/03/24 07:05 PM,2024,ExRedPill
91,The point of life is NOT sex,,ButterscotchSharp173,/r/ExRedPill,26/04/24 04:21 AM,2024,ExRedPill
84,I think my boyfriend is a redpiller,,bloops_and_bleeps,/r/ExRedPill,05/02/24 09:26 PM,2024,ExRedPill
84,I ruined my life by being horrible to women. Where do I go from here?,,MousseLong3537,/r/ExRedPill,24/10/24 03:13 AM,2024,ExRedPill
84,Why the hell are red pill influencers so obsessed with young men losing their virginity?,,Truthteller1995,/r/ExRedPill,10/07/24 07:32 PM,2024,ExRedPill
83,Redpill is a cope for a terrifyingly chaotic world,,WknessTease,/r/ExRedPill,20/08/24 11:18 PM,2024,ExRedPill
83,"Self-Improvement Youtuber Hamza has now gone to promoting hurting other people via aggression, specifically women, as a ""masculine goal"", because ""they secretly like it"". How far is this going to go?",,Sometus,/r/ExRedPill,07/03/24 04:02 PM,2024,ExRedPill
83,Redpillers are extremely childish,,Top-Mechanic-5494,/r/ExRedPill,07/08/24 08:50 PM,2024,ExRedPill
82,What’s the hate towards older women?,,CompleteTadpole40,/r/ExRedPill,17/09/24 02:21 AM,2024,ExRedPill
80,Red Pill losing credibility,,Distinct_Key_590,/r/ExRedPill,02/10/24 10:43 PM,2024,ExRedPill
77,Just unsubbed from purplepilldebate…,,Equivalent-Cat5414,/r/ExRedPill,09/06/24 11:30 AM,2024,ExRedPill
77,Tradwives/ redpill women ruined my worldview,,Ambitious-Angel-777,/r/ExRedPill,08/04/24 02:00 AM,2024,ExRedPill
76,"The redpill ruined my mental health and turned me (24, F) into a misandrist.",,fashoclock,/r/ExRedPill,29/02/24 03:52 AM,2024,ExRedPill
74,Yet another relationship ruined by Red Pill ideas,,Unfair_Stop_310,/r/ExRedPill,16/03/24 06:25 PM,2024,ExRedPill
71,Woman said I’m a loser because of my job,,Brave-Put-6572,/r/ExRedPill,05/11/24 04:27 PM,2024,ExRedPill
71,Why do men talk a lot about their ‘prime’,,IndicationReal8195,/r/ExRedPill,10/03/24 01:00 PM,2024,ExRedPill
71,"Beware, MRA roots are misogynistic and anti-women rights.",,Brilliant_Program_39,/r/ExRedPill,10/02/24 11:59 PM,2024,ExRedPill
70,"Reminder: Redpill and blackpill is a cult, exploiting vulnerable people",,No_Club_4730,/r/ExRedPill,11/02/24 10:59 AM,2024,ExRedPill
69,Contradiction I’ve noticed,,DielsAlderRxn87,/r/ExRedPill,21/05/24 11:19 PM,2024,ExRedPill
68,I realized that Andrew Tate is a weak man,,xStar1516,/r/ExRedPill,26/10/24 12:38 AM,2024,ExRedPill
68,Is it just me or are dating gurus just insecure men that blame women for their short comings?,,spankyourkopita,/r/ExRedPill,24/10/24 09:59 PM,2024,ExRedPill
68,I had a debate with a hardcore RedPill man I know & he went silent.,,ProfessionalToe5633,/r/ExRedPill,17/07/24 07:11 PM,2024,ExRedPill
67,I realized i was wrong,,chels4ever,/r/ExRedPill,15/05/24 07:09 AM,2024,ExRedPill
67,Honestly as a man who is in his late 20s I hate that we live in a patriarchy.,,Tasty-Knowledge5032,/r/ExRedPill,22/11/24 12:22 AM,2024,ExRedPill
66,Dating advice from a red piller,,Able_Psychology3665,/r/ExRedPill,05/01/24 12:18 AM,2024,ExRedPill
65,I can’t help but feel like the red pill ruined my several year relationship + engagement.,,LazyDaisyCake,/r/ExRedPill,04/09/24 04:46 PM,2024,ExRedPill
65,I don't believe the majority of women prefer average sized penises,,GorrilaRuffy,/r/ExRedPill,07/02/24 01:45 PM,2024,ExRedPill
64,How do Red Pill Men feel when their girlfriend calls them out on their game?,,para_d,/r/ExRedPill,22/09/24 08:54 AM,2024,ExRedPill
64,"Is there a community for women who dated a normal guy, and then their normal bf turns hxc redpill and now having to deal with leaving them and the long lasting abuse the guy put them thru cause of the toxic red pill community?",,THEbunnyfawn,/r/ExRedPill,31/03/24 09:46 PM,2024,ExRedPill
63,"""90% of men are incels""",,Lemon-Aid917,/r/ExRedPill,28/06/24 04:33 AM,2024,ExRedPill
62,What's the worst redpill logic you used to buy into?,,forgotten-login,/r/ExRedPill,06/02/24 12:17 PM,2024,ExRedPill
61,Manosphere exit survey,,Away-Walrus6497,/r/ExRedPill,05/01/24 03:51 PM,2024,ExRedPill
60,Why???,,NicM80,/r/ExRedPill,18/04/24 02:37 PM,2024,ExRedPill
60,PSA: Evolutionary psychology is mostly garbage.,,meleyys,/r/ExRedPill,06/04/24 12:29 AM,2024,ExRedPill
60,Red pill tries to strip you of your humanity.,,Schmutzcityusa,/r/ExRedPill,14/02/24 06:49 AM,2024,ExRedPill
59,I feel like I threw away a chance with a great girl because of Red Pill,,wwereddit123,/r/ExRedPill,14/02/24 02:12 AM,2024,ExRedPill
58,Watching how dating works for my friends has been black pilling me,,Junior_Emotion87,/r/ExRedPill,02/08/24 10:52 PM,2024,ExRedPill
58,virtuous women,,Josie4321,/r/ExRedPill,10/05/24 01:30 AM,2024,ExRedPill
57,The irrelevant dudes from Fresh and Fit,,Caramel_Infinite,/r/ExRedPill,03/01/24 07:56 PM,2024,ExRedPill
57,"Please help me, redpill is making me suicidal",,Cool_Position_6191,/r/ExRedPill,11/02/24 11:15 PM,2024,ExRedPill
57,Boyfriend turned red pill.. now i need to leave.. but how?,,mehhh-6,/r/ExRedPill,16/01/24 10:59 AM,2024,ExRedPill
56,To any men struggling with seeking validation through female attention; maybe my story can help you. (And maybe men that are better than me can help articulate my point better than me),,Crafty_Outcome_4654,/r/ExRedPill,07/07/24 06:41 AM,2024,ExRedPill
56,Why The Red Pill Is NOT For Asian Men,,theasianplayboy,/r/ExRedPill,30/09/24 06:28 PM,2024,ExRedPill
55,Redpill is despair inducing,,Fobias89,/r/ExRedPill,02/09/24 12:15 PM,2024,ExRedPill
55,I feel like this redpill stuff is making me insecure.,,Sea-Ease-549,/r/ExRedPill,26/03/24 11:27 AM,2024,ExRedPill
55,Here’s why it doesn’t make sense to care about a women’s number of sexual partners if you don’t care more about education when looking to avoid divorce:,,Justwannaread3,/r/ExRedPill,21/02/24 04:48 AM,2024,ExRedPill
55,Official List of Unhealthy Beliefs,,Getitthe,/r/ExRedPill,09/06/24 08:00 PM,2024,ExRedPill
55,Attention hijacking and keeping true to this sub,,luridlurker,/r/ExRedPill,05/05/24 05:45 AM,2024,ExRedPill
54,"What do you think about Andrew Tate's fans who loves to reply about his criticism like ""tell that into his face, you armchair warrior"" or ""go challenge him into a fight and prove your words, lol"". I mean, are they serious? What's they are trying to prove by that?",,AlexFerrana,/r/ExRedPill,21/12/24 12:15 AM,2024,ExRedPill
53,Seeing Beyond the Redpill Narrative: Lessons from My Ethiopian Upbringing,,tesheabebe,/r/ExRedPill,15/05/24 09:20 PM,2024,ExRedPill
52,Why is there always so much pushback to young men who claim that the reason they can’t get a date is 100% the way they look?,,Citrusfukinrox,/r/ExRedPill,04/08/24 03:30 PM,2024,ExRedPill
52,What pisses me off the most about redpillers,,Top-Mechanic-5494,/r/ExRedPill,15/04/24 08:09 PM,2024,ExRedPill
51,The preference for virginity in men who aren’t virgins is sheer hypocrisy and unjustifiable by all means,,AppropriateGround623,/r/ExRedPill,17/06/24 12:56 AM,2024,ExRedPill
51,Does anyone else just randomly get recommended anti-woman videos on YouTube?,,LoomingsThrowaway,/r/ExRedPill,29/08/24 08:39 PM,2024,ExRedPill
49,Something I don't get about redpillers.,,Brilliant_Program_39,/r/ExRedPill,06/02/24 07:42 PM,2024,ExRedPill
49,isn't it hypocrite😭?,,icyy8,/r/ExRedPill,30/04/24 03:03 PM,2024,ExRedPill
49,Red pill attitude towards porn,,tromp-et,/r/ExRedPill,13/02/24 10:52 PM,2024,ExRedPill
49,Self-help RP: The case of Hamza Ahmad,,AppropriateGround623,/r/ExRedPill,06/07/24 12:58 AM,2024,ExRedPill
47,How to spot a red pill guy easily on a convo?,,That_Back3371,/r/ExRedPill,22/03/24 07:49 PM,2024,ExRedPill
46,"Genuinely curious, what’s obsession with women and sex?",,Other_Taro_3806,/r/ExRedPill,24/08/24 02:54 PM,2024,ExRedPill
45,Things are not what I thought (Musings),,No-Meaning-7629,/r/ExRedPill,08/12/24 07:46 PM,2024,ExRedPill
45,Trying to avoid redpill men,,Josie4321,/r/ExRedPill,15/09/24 12:11 AM,2024,ExRedPill
43,I have realized that... I'm actually good-looking.,,KaliFlesh,/r/ExRedPill,15/06/24 09:33 PM,2024,ExRedPill
43,"My Cousin (14) is an Andrew Tate fan, how do I show him the truth?",,Direct-Strength7598,/r/ExRedPill,03/09/24 07:49 PM,2024,ExRedPill
43,Lost all respect for Fresh and Fit today.,,Deficatingtree123,/r/ExRedPill,06/04/24 03:30 AM,2024,ExRedPill
42,What does this quote mean?,,Catdog13579,/r/ExRedPill,31/05/24 05:42 PM,2024,ExRedPill
42,Is the redpill a gateway to the alt right ?,,BOBBYZROY,/r/ExRedPill,22/06/24 08:43 PM,2024,ExRedPill
42,I am ex redpill and started a youtube channel that will be somewhat dedicated to exposing the ideology for what it is. I just uploaded a new video. Let me know what you think. I address the red pill idea that it is better to date 18 and 19 year old girls.,,ethiopianboson,/r/ExRedPill,21/12/24 12:16 PM,2024,ExRedPill
42,Red Pill is bullshit.,,John_MarstonRDR2,/r/ExRedPill,11/01/24 04:34 AM,2024,ExRedPill
42,Has anyone ever asked RPers how they reconcile their 2 main contradictory beliefs?,,janyybek,/r/ExRedPill,04/11/24 02:01 AM,2024,ExRedPill
42,How can I stop seeing myself as post-wall?,,snoort,/r/ExRedPill,03/09/24 12:18 PM,2024,ExRedPill
41,Message to Struggling Men!,,Dramatic_Top_1503,/r/ExRedPill,29/12/24 08:37 PM,2024,ExRedPill
41,"My personality type will never be popular with women, and I have hard time coping with that",,Not-a-penguin_,/r/ExRedPill,23/10/24 09:02 PM,2024,ExRedPill
41,"Man Reads ""Men Who Hate Women"" by Laura Bates",,michaelchief,/r/ExRedPill,16/04/24 03:26 PM,2024,ExRedPill
41,My bf broke up with me because of my body count,,Immediate-Summer8964,/r/ExRedPill,08/01/24 01:58 PM,2024,ExRedPill
41,Why do redpillers say a woman is solipsistic for looking for a man with stable career but do something similar?,,TheToxicFeminist,/r/ExRedPill,13/04/24 08:30 PM,2024,ExRedPill
41,"If a ""praxiology"" tells me what I should desire, it's garbage.",,ApartmentUpper4780,/r/ExRedPill,06/05/24 02:54 AM,2024,ExRedPill
41,Continuing to detox from the red pill,,New-Strawberry8205,/r/ExRedPill,09/12/24 08:51 PM,2024,ExRedPill
40,Has anyone here lost a female friend to the red pill ideology?,,Willing_Coconut809,/r/ExRedPill,08/06/24 02:56 PM,2024,ExRedPill
40,I can’t think about rp guys raising a children,,That_Back3371,/r/ExRedPill,19/04/24 04:11 PM,2024,ExRedPill
40,My BFs redpill beliefs are triggering to me,,Chakita1,/r/ExRedPill,15/04/24 10:00 PM,2024,ExRedPill
39,The red pill nonsense,,Dismal_Pension866,/r/ExRedPill,30/01/24 05:15 PM,2024,ExRedPill
39,Avoiding the black pill makes me happy.,,ViceNote,/r/ExRedPill,24/02/24 01:15 AM,2024,ExRedPill
39,My trans cousin is falling down the red pill rabbit hole and it's incredibly scary to watch.,,MangOrion2,/r/ExRedPill,25/07/24 09:36 PM,2024,ExRedPill
39,Why is it that the most outwardly sexist guys I know that do the best with women?,,Tall_Promotion_7160,/r/ExRedPill,25/04/24 02:48 PM,2024,ExRedPill
39,"How common is it for women to not be sexually/physically attracted to their partners (husband/boyfriend/etc.)? Or, at least, “as” sexually/physically attracted as they had been to other dudes/hookups/ONS/etc.",,NoRefrigerator267,/r/ExRedPill,28/11/24 03:56 AM,2024,ExRedPill
39,I would caution people here against saying that men here are unable to get laid or dates because they're misogynistic,,Tall_Promotion_7160,/r/ExRedPill,17/04/24 05:17 AM,2024,ExRedPill
39,Gonna see a mental health professional.,,ViceNote,/r/ExRedPill,28/02/24 01:40 AM,2024,ExRedPill
39,As a woman how can I avoid being affected by reading misogynistic comments on the internet?,,aleatornh,/r/ExRedPill,27/08/24 01:15 AM,2024,ExRedPill
39,"Am I desperate because my partner is not a ""provider""?",,Top-Mechanic-5494,/r/ExRedPill,19/08/24 07:51 PM,2024,ExRedPill
38,Is following red pill content pages a red flag?,,solanas_awakening,/r/ExRedPill,08/03/24 02:40 AM,2024,ExRedPill
38,How do I look less threatening to women?,,KaliFlesh,/r/ExRedPill,28/05/24 12:38 AM,2024,ExRedPill
36,What was the lure for RedPill?,,UnfortunateJones,/r/ExRedPill,17/01/24 08:44 AM,2024,ExRedPill
35,"From now on, if I like a girl, I'll ask her out/ask for her number.",,ViceNote,/r/ExRedPill,01/04/24 09:52 PM,2024,ExRedPill
35,"How do I not internalize ""all men are trash"" content online?",,Catdog13579,/r/ExRedPill,17/06/24 05:38 AM,2024,ExRedPill
35,I got more than 4 girls approaching me this year without even me tring.,,tesheabebe,/r/ExRedPill,14/05/24 04:02 PM,2024,ExRedPill
35,Something I noticed reading The Rational Male,,Brilliant_Program_39,/r/ExRedPill,08/02/24 06:20 PM,2024,ExRedPill
35,Virginity,,Admirable_Bid_9193,/r/ExRedPill,09/01/24 09:26 PM,2024,ExRedPill
34,Anyone here go from red pill to attachment theory?,,sleepypanda24_10,/r/ExRedPill,25/10/24 05:30 AM,2024,ExRedPill
34,Not All Women,,PutsWomenOnPedestal,/r/ExRedPill,03/11/24 02:13 PM,2024,ExRedPill
34,I'm losing my Dad to the red pill and the right,,FeeliGSaasy,/r/ExRedPill,26/02/24 09:51 PM,2024,ExRedPill
34,Real life helps,,chels4ever,/r/ExRedPill,30/05/24 01:45 AM,2024,ExRedPill
34,thoughts from a ex red pill man,,ButterscotchSharp173,/r/ExRedPill,08/04/24 06:15 PM,2024,ExRedPill
33,"The Most Dangerous ""Red Pill"" Lie",,michaelchief,/r/ExRedPill,02/05/24 10:55 AM,2024,ExRedPill
33,Do you think the manosphere has a eugenics agenda?,,Syphonfilterfan93,/r/ExRedPill,02/09/24 04:27 PM,2024,ExRedPill
33,How do I not get frustrated when I see guys who exhibit the qualities I constantly see women here say women don't like doing well with women?,,dogickker,/r/ExRedPill,14/05/24 02:51 AM,2024,ExRedPill
32,How do you deal with your insane envy of promiscuous people?,,6022141023,/r/ExRedPill,21/10/24 04:33 AM,2024,ExRedPill
32,"An anti-Red Pill dating coach I enjoyed listening to on Youtube, Anthony Recenello, brags in his audiobook about the age of his very young gf - should I stop listening to him?",,,/r/ExRedPill,21/06/24 01:12 PM,2024,ExRedPill
32,"Exredpillers, what made you leave the cult?",,Cool_Position_6191,/r/ExRedPill,13/02/24 08:20 PM,2024,ExRedPill
32,"As a woman, what signs should I look out for in a man that might indicate whether or he is a misogynist?",,Then_Ladder6073,/r/ExRedPill,21/07/24 07:56 PM,2024,ExRedPill
32,How many of you dated cluster B women?,,Schmutzcityusa,/r/ExRedPill,15/01/24 11:43 PM,2024,ExRedPill
31,Did you have unrealistic or idealistic standards about women before you became a redpiller?,,KillingPunch,/r/ExRedPill,14/03/24 11:18 AM,2024,ExRedPill
31,I hate men but want to stop. (F/26),,cupiddelock3,/r/ExRedPill,04/04/24 04:53 AM,2024,ExRedPill
31,"If you were sex trafficked by people within Red Pill/PUA, please be sure to report it, even if it's outside statute of limitations. We've been able to prove that there was an international trafficking ring...",,Time_Astronaut_42,/r/ExRedPill,12/04/24 11:03 PM,2024,ExRedPill
31,I’m trauma bonded to a red pill guy who pressed charges against me,,Equivalent_Fruit4710,/r/ExRedPill,10/08/24 06:49 PM,2024,ExRedPill
31,Ex-Red-Pillers; what was your final straw?,,BucketListM,/r/ExRedPill,21/07/24 04:20 PM,2024,ExRedPill
31,why do incels get angry when other incel gets a girlfriend,,MaynardRosemary,/r/ExRedPill,17/02/24 02:52 AM,2024,ExRedPill
31,Is there a way to not see every woman I meet as a potential partner,,AppropriateCoconut92,/r/ExRedPill,03/07/24 09:03 PM,2024,ExRedPill
30,Is it Red-Pill to Believe that “Leagues” Exist?,,octave120,/r/ExRedPill,12/08/24 08:01 AM,2024,ExRedPill
30,This might be interesting to those worried about how they look,,xvszero,/r/ExRedPill,13/07/24 01:07 AM,2024,ExRedPill
30,Do men who call themselves & other men “Kings” & the “prize” Red Pill?,,Healthy_Source_9752,/r/ExRedPill,23/02/24 01:03 AM,2024,ExRedPill
30,"Why is confidence so much more important than other good traits like humor, kindness,etc. when it comes to dating?",,AlphaTrion2628,/r/ExRedPill,11/04/24 08:05 PM,2024,ExRedPill
29,My friend has fallen into red pill community and I think I’ve lost him for good,,Proof-Pollution454,/r/ExRedPill,14/10/24 07:33 PM,2024,ExRedPill
29,How do I as a woman stop internalizing the male gaze?,,Then_Ladder6073,/r/ExRedPill,22/07/24 09:15 PM,2024,ExRedPill
29,Has hatred of women increased in the past couple of years?,,aduckonthepond,/r/ExRedPill,09/10/24 12:46 AM,2024,ExRedPill
29,Any tips for an ethical incel?,,Height-Increase,/r/ExRedPill,13/05/24 09:57 PM,2024,ExRedPill
29,The way redpill guys chat and text is ridiculous lmao,,That_Back3371,/r/ExRedPill,28/03/24 05:29 PM,2024,ExRedPill
29,Update: My Cousin was an Andrew Tate Fan,,Direct-Strength7598,/r/ExRedPill,08/09/24 06:38 PM,2024,ExRedPill
28,Does the Red Pill damage the nuclear family structure,,Sensitive_Panda_6245,/r/ExRedPill,21/02/24 04:10 AM,2024,ExRedPill
28,How do I stop identifying with femcel ideology?,,Ambitious-Angel-777,/r/ExRedPill,19/03/24 10:46 AM,2024,ExRedPill
28,I feel used and dirty,,Quizziqualquetzal,/r/ExRedPill,18/01/24 07:41 PM,2024,ExRedPill
28,How These Men Left the Manosphere and Why Some May Never,,enriquegp,/r/ExRedPill,20/11/24 09:11 PM,2024,ExRedPill
28,The negative impact of red pill ideas on women?,,Havel68,/r/ExRedPill,13/09/24 10:56 PM,2024,ExRedPill
28,Being a black man and why I was black/redpilled about women.,,KaliFlesh,/r/ExRedPill,02/06/24 04:45 AM,2024,ExRedPill
28,Losing a loved one to red pill ideology — and trying to get a step or two head. Any insight?,,Itsraynie,/r/ExRedPill,15/05/24 01:14 AM,2024,ExRedPill
28,Red pillers are going Insane,,Comingtoyoulive16,/r/ExRedPill,23/05/24 09:41 PM,2024,ExRedPill
28,"Reading r/nothowgirlswork , and r/twoxchromosomes subreddit makes me feel like shit and angry and I don’t know why.",,Possible-Shift249,/r/ExRedPill,20/04/24 06:23 AM,2024,ExRedPill
27,"Checkmate, Redpillers",,Sufficient_Event_520,/r/ExRedPill,02/04/24 12:21 AM,2024,ExRedPill
27,Men Don’t Care About Men,,sinodauce131,/r/ExRedPill,22/11/24 09:49 PM,2024,ExRedPill
27,"Women, how have you felt about your male partner sharing their emotions, vulnerabilities, etc with you?",,Schmutzcityusa,/r/ExRedPill,19/02/24 10:19 PM,2024,ExRedPill
27,The significant flaws of The Rational Male and its author Rollo Tomassi,,Dramatic_Top_1503,/r/ExRedPill,16/07/24 09:26 PM,2024,ExRedPill
26,How can you un-loser yourself as a 36 year old virgin?,,6022141023,/r/ExRedPill,16/03/24 02:47 AM,2024,ExRedPill
26,Suddenly feeling empty about my partner after leaving TRP.,,Rat-Wack05,/r/ExRedPill,29/04/24 08:56 PM,2024,ExRedPill
26,This shit really effected my self esteem and I don’t know how to get back to normal again,,Adrillai,/r/ExRedPill,20/06/24 07:44 PM,2024,ExRedPill
26,Porn addiction is ruining my mental health,,No-Leading2343,/r/ExRedPill,07/03/24 07:51 AM,2024,ExRedPill
26,I have become a slave to ideologies and I want to break free,,KaliFlesh,/r/ExRedPill,13/06/24 10:24 PM,2024,ExRedPill
26,"Girl I had been crushing on rejected me, hooked up with a much better looking guy and is now talking to me again wanting to reconnect?",,Over_Platypus144,/r/ExRedPill,07/04/24 07:06 PM,2024,ExRedPill
