Upvotes,Title,col_2,col_3,col_4,col_5,Year,Subreddit
31,What are some good dating/hookup advice for men with anxious attatchement/nice guys?,,Philipparty,/r/ExRedPill,03/02/21 02:45 PM,2021,ExRedPill
31,I found a really good video involving how PUA has affected the dating culture.,,softver787,/r/ExRedPill,16/01/21 08:12 AM,2021,ExRedPill
31,Most Red Pill Users are Jealous of Women's Sexual Power in our Society,,asdewtyz,/r/ExRedPill,06/06/21 06:40 PM,2021,ExRedPill
31,It's possible that we've missed signs of interest and unintentionally friendzoned a girl in the past.,,AdhesivenessOk9106,/r/ExRedPill,17/10/21 12:08 AM,2021,ExRedPill
31,"The Red Pill trolls teach and utilize tactics that cause people to J.A.D.E. which is well-known in recovery groups. Learn what it is, how to spot it, and how to avoid it here.",,AIisVolatPropriis,/r/ExRedPill,10/06/21 07:46 PM,2021,ExRedPill
31,"Men's mental health and ""the red pill""",,whatsthecosmicjoke,/r/ExRedPill,29/07/21 04:18 AM,2021,ExRedPill
31,This red piller claims that he has slept with over 150 women. Sounds like bs to me.,,salvulcanoloser,/r/ExRedPill,15/07/21 07:43 PM,2021,ExRedPill
31,Dating has nothing to do with your social life,,Dododo0808,/r/ExRedPill,30/05/21 02:20 PM,2021,ExRedPill
31,The dating subreddits are becoming redpill and it’s annoying,,Left_Yogurtcloset779,/r/ExRedPill,21/09/21 08:04 PM,2021,ExRedPill
31,"How to prevent myself from getting sucked into the red pill, MGTOW?",,matveialt,/r/ExRedPill,30/03/21 02:11 PM,2021,ExRedPill
31,"Being shy as a guy is definitely the worst possible trait, right?",,KindKitten25055,/r/ExRedPill,07/09/21 07:28 PM,2021,ExRedPill
30,My plan as an incel,,Physical-Ebb4350,/r/ExRedPill,19/08/21 08:56 PM,2021,ExRedPill
30,"In your opinion, who's the worst Red Piller and why ?",,R3D_Brain,/r/ExRedPill,28/05/21 03:58 PM,2021,ExRedPill
30,Theory:Wall is a shaming tactic to make young beautiful women settle for old wrinkly dudes who slept around in their 20s.,,Guilty_Squash7098,/r/ExRedPill,17/11/21 06:30 AM,2021,ExRedPill
30,Do you think the red pill/alpha males/incel movement is fueled by narcissists?,,Zenia_neow,/r/ExRedPill,17/05/21 05:21 PM,2021,ExRedPill
30,TRP has caveman-level logic.,,West-Emu-8696,/r/ExRedPill,02/06/21 08:39 PM,2021,ExRedPill
30,Anxiety with women,,SbVta76,/r/ExRedPill,02/07/21 05:13 PM,2021,ExRedPill
30,Isn't hypergamy (or whatever the male version is) something women should worry more about in men?,,spankyourkopita,/r/ExRedPill,30/09/21 01:14 AM,2021,ExRedPill
30,Trying to find myself again,,JohnZoffman,/r/ExRedPill,08/08/21 06:27 PM,2021,ExRedPill
30,Ex-MGTOW at what point did you realize you had gone too far?,,mercinerary,/r/ExRedPill,28/03/21 06:22 PM,2021,ExRedPill
30,The reason I am in the red pill is because I am ashamed of my sex drive,,asdewtyz,/r/ExRedPill,28/06/21 11:41 PM,2021,ExRedPill
30,Are rape apologists too dumb to realize masturbation is always an option for men?,,PutsWomenOnPedestal,/r/ExRedPill,03/12/21 07:34 PM,2021,ExRedPill
30,For men who constantly get rejected where did they go wrong and why are they like that?,,spankyourkopita,/r/ExRedPill,12/11/21 05:23 AM,2021,ExRedPill
30,Has anyone been keeping up with the Fresh n Fit vs Aba and Preach fallout?,,Donotenter77,/r/ExRedPill,17/08/21 07:50 PM,2021,ExRedPill
30,Support group for men who are struggling with red pill recovery? I am suffering and I feel like I don’t have much longer.,,RedPillerRecover,/r/ExRedPill,13/11/21 07:07 AM,2021,ExRedPill
30,"Women of exredpill, is it true you don't like it when men are vulnerable with you?",,JUMPsuperstar,/r/ExRedPill,30/09/21 05:41 PM,2021,ExRedPill
30,Why do dudes care so much about what women or other people do? [Redpill detox],,yulemguysmmoja,/r/ExRedPill,05/05/21 06:40 AM,2021,ExRedPill
30,Biggest danger of trp ?,,Mq200,/r/ExRedPill,02/08/21 11:53 AM,2021,ExRedPill
30,"How do PUAs have the energy to do all the game, mind game tactic, alpha persona shit?",,imbecile_keshig,/r/ExRedPill,15/05/21 05:16 PM,2021,ExRedPill
29,Went from allegedly being against radical feminism to just mocking the most basic principles of feminism.,,alexanderwanxiety,/r/ExRedPill,28/10/21 01:23 PM,2021,ExRedPill
29,"Women focus on careers because a career is a good investment, a man generally isn't",,DiamondLilyD,/r/ExRedPill,11/09/21 05:35 AM,2021,ExRedPill
29,Women and men are not computers,,Mh882130,/r/ExRedPill,18/12/21 04:21 AM,2021,ExRedPill
29,"Thoughts on FDS (""vetting"")",,RedPillDetox,/r/ExRedPill,18/09/21 03:38 PM,2021,ExRedPill
29,"Red pillers have impossible standards for the wrong women, not women having impossible standards for the wrong men.",,West-Emu-8696,/r/ExRedPill,29/06/21 06:32 PM,2021,ExRedPill
29,Fear of rejection can lead to more rejection,,tiposk,/r/ExRedPill,11/02/21 01:00 AM,2021,ExRedPill
29,The death of communal spaces,,PSSD_Kara,/r/ExRedPill,15/03/21 10:09 PM,2021,ExRedPill
29,The Red Pill teaches that women can't love you for you. Suggestions on how to get past that?,,JUMPsuperstar,/r/ExRedPill,28/09/21 05:10 PM,2021,ExRedPill
29,If I walked into anyone’s apartment and saw this I’d think I was lured into a sociopath’s lair,,alexanderwanxiety,/r/ExRedPill,15/10/21 01:28 PM,2021,ExRedPill
29,Why bother working on yourself? This is why.,,zoemondo,/r/ExRedPill,30/06/21 04:28 PM,2021,ExRedPill
29,"""Potentially unsafe groups or leaders come off very nice at first, they go for vulnerable people who are looking for answers, lonely, what you'd call 'normal people.' They're very good at what they do and can get people to believe anything. ..."" -Margaret Singer, Ph.D.",,MsDianaBurnwood,/r/ExRedPill,26/08/21 02:31 PM,2021,ExRedPill
29,Mediocre Tutorials and Reviews,,LunaLoveGood22916,/r/ExRedPill,03/11/21 06:50 PM,2021,ExRedPill
29,Most egregious/stupid thing you’ve heard a RPer or RP guru say?,,pekkauser,/r/ExRedPill,22/12/21 09:14 AM,2021,ExRedPill
29,Are there any women here who had a redpill phase and are trying to get out?,,Min_kast,/r/ExRedPill,13/11/21 05:54 PM,2021,ExRedPill
29,When Older Guys try to fight for Younger Girls,,Cowboys0923,/r/ExRedPill,13/06/21 01:13 AM,2021,ExRedPill
29,"Is the ""red pill manosphere"" a gateway to the dissident right? (My experience)",,FiveStringKing,/r/ExRedPill,13/09/21 08:51 AM,2021,ExRedPill
29,How do I stop my misogynistic outlook?,,xSathya,/r/ExRedPill,13/01/21 10:15 PM,2021,ExRedPill
29,Do men really have it hard and women have it easy in the dating world?,,spankyourkopita,/r/ExRedPill,11/11/21 10:50 PM,2021,ExRedPill
29,The Red Pill/Manosphere Isn't a Beneficial or Productive Space for Men,,redpillnonsense,/r/ExRedPill,13/06/21 06:56 PM,2021,ExRedPill
29,What makes people believe that there're magic pills that can fix all their problems like redpill or any kind of cults.,,imbecile_keshig,/r/ExRedPill,03/07/21 11:54 AM,2021,ExRedPill
29,"Is the ""normalisation"" of sex a contributing factor to the continual rise of incel culture?",,JimBeamAndCoke2016,/r/ExRedPill,16/08/21 05:00 AM,2021,ExRedPill
29,Is the drive of the Red Pill community driven by money/cult-like behavior?,,ThePhaser2,/r/ExRedPill,13/04/21 04:54 PM,2021,ExRedPill
29,AWALT (All women are like that) Debunked,,LilDevil22,/r/ExRedPill,30/07/21 03:16 AM,2021,ExRedPill
29,How would red pillers actually do if they tried their crap in real life? How would they react if it failed?,,spankyourkopita,/r/ExRedPill,11/06/21 11:11 PM,2021,ExRedPill
29,"If you're starting to talk in circle in that one particular topic you're interested and try to make any nonexisted point for that topic, remember you're starting to ingrain or become part of the cult.",,imbecile_keshig,/r/ExRedPill,27/03/21 01:17 PM,2021,ExRedPill
28,What's the best and worst thing Red Pill has taught you?,,ModernManLevi,/r/ExRedPill,05/03/21 02:00 AM,2021,ExRedPill
28,80/20 and SMV Debunked (Studies and Data),,ET-Osmio-180599,/r/ExRedPill,12/10/21 11:06 PM,2021,ExRedPill
28,Video to add to the first aid kit and why I think so.,,HowardClassic,/r/ExRedPill,10/05/21 07:24 PM,2021,ExRedPill
28,"Random thought: Why ""inceldom"" is rising",,RedPillDetox,/r/ExRedPill,09/06/21 08:16 PM,2021,ExRedPill
28,Mgtow as a cult: Talked to someone I met on this forum,,ourherocomic,/r/ExRedPill,25/03/21 08:17 PM,2021,ExRedPill
28,Their is now a Petition to get Kevin Samuels off YouTube.,,Left_Yogurtcloset779,/r/ExRedPill,22/07/21 04:37 PM,2021,ExRedPill
28,This man expresses so many of my worries for young men right now,,DarkestTimeline24,/r/ExRedPill,17/12/21 01:51 PM,2021,ExRedPill
28,that new Sex/Life show got me FUCKED UP,,JustHereForTheGash,/r/ExRedPill,06/07/21 02:04 PM,2021,ExRedPill
28,What is with red pill saying that all western women are trash? Why do they say that they would rather get a European woman instead of western women?,,electronicfusionz,/r/ExRedPill,26/11/21 11:07 PM,2021,ExRedPill
28,"Lurker here, I’m a little more purple pilled but my God this right here....",,Kalvaire,/r/ExRedPill,12/07/21 07:28 PM,2021,ExRedPill
28,"Guys, I come bearing goods. It gets better. Holy crap, it gets better. Let go of the Red Pill and follow me into the rising sun",,JUMPsuperstar,/r/ExRedPill,10/12/21 05:27 AM,2021,ExRedPill
28,How do I stop feeling like a shit every time I get ghosted?,,ImpressivePiccolo9,/r/ExRedPill,28/07/21 02:33 PM,2021,ExRedPill
28,What was your goal as a RP-ler,,PrincessTiaraLove,/r/ExRedPill,05/10/21 10:29 PM,2021,ExRedPill
28,I'm scared of women..,,KindKitten25055,/r/ExRedPill,02/09/21 11:34 PM,2021,ExRedPill
28,Feeling shame or weak for just being naturally empathic to people / women?,,perla-madonna,/r/ExRedPill,06/03/21 07:25 PM,2021,ExRedPill
28,"A few fundamental pieces of advice for ex-red pillers, but pretty much anyone else too.",,cooconaash,/r/ExRedPill,09/02/21 09:38 PM,2021,ExRedPill
28,mgtow is just a sham and they fool themselves,,OrganizationFar1943,/r/ExRedPill,15/10/21 11:25 PM,2021,ExRedPill
27,Why does it need to go from friendly to sexual instantly?!?,,RedPillKryptonite,/r/ExRedPill,14/05/21 07:16 PM,2021,ExRedPill
27,"I acted nice and helped a girl for something and now she invited me to her place to have sex, what happened to the redpill theories of being toxic etc?",,perla-madonna,/r/ExRedPill,12/09/21 05:28 PM,2021,ExRedPill
27,Fuck the red pill toxicity for ruining my relationship,,Weak_Garden4488,/r/ExRedPill,04/12/21 01:51 AM,2021,ExRedPill
27,Mediocre Tutorials and Reviews just went FULL RED PILL! And it's kind of sad and pathetic,,MicahMX700,/r/ExRedPill,08/06/21 04:57 AM,2021,ExRedPill
27,Importance of looks.,,atheistvegeta,/r/ExRedPill,17/07/21 08:24 AM,2021,ExRedPill
27,Why do we label people alpha and beta? It's so stupid.,,spankyourkopita,/r/ExRedPill,25/09/21 10:42 PM,2021,ExRedPill
27,If you could press a switch that would turn you asexual would you press it?,,PutsWomenOnPedestal,/r/ExRedPill,10/09/21 04:43 PM,2021,ExRedPill
27,Do you think we should consider the red pill as a men’s issue as well as a women’s issue?,,East-Reflection4794,/r/ExRedPill,04/04/21 09:27 PM,2021,ExRedPill
27,Talking with a red pill man,,cabsmom2020,/r/ExRedPill,23/07/21 06:17 PM,2021,ExRedPill
27,A friendly reminder about RP and self help youtubers,,W-Pirate,/r/ExRedPill,29/06/21 02:49 AM,2021,ExRedPill
27,The concept about n count is a bunch of absolute garbage,,Buckley92,/r/ExRedPill,12/01/21 10:07 AM,2021,ExRedPill
27,"I want to thank my parents, and my friends for preventing me from radicalization.",,West-Emu-8696,/r/ExRedPill,23/05/21 07:04 AM,2021,ExRedPill
27,Hypergamy is real but both sexes have it and it is not what rp says it is.,,Mh882130,/r/ExRedPill,16/12/21 10:56 PM,2021,ExRedPill
26,About Single mothers,,ET-Osmio-180599,/r/ExRedPill,12/12/21 12:21 PM,2021,ExRedPill
26,Who Is the WORST red pill [youtuber] (I use that term VERY loosely btw),,MicahMX700,/r/ExRedPill,02/06/21 04:00 AM,2021,ExRedPill
26,Older women and dating,,ZealousidealFig5,/r/ExRedPill,26/12/21 03:42 PM,2021,ExRedPill
26,what does 'incel' even mean anymore?,,TheUberDoomer,/r/ExRedPill,05/09/21 08:41 AM,2021,ExRedPill
26,The redpill exit,,Yaycutietie,/r/ExRedPill,01/02/21 04:29 AM,2021,ExRedPill
26,TRP trauma I can't get rid of. Plz help.,,TheDrWinston,/r/ExRedPill,04/05/21 07:34 PM,2021,ExRedPill
26,"My brother is falling deeper and deeper into Red Pill-type ideology, and I am getting exasperated trying to pull him out of it.",,apost54,/r/ExRedPill,10/12/21 04:39 PM,2021,ExRedPill
26,Why the redpill is getting big and bigger,,dm_if_you_femboy,/r/ExRedPill,29/08/21 02:40 PM,2021,ExRedPill
26,TW - Male Suicide Research,,susie_research,/r/ExRedPill,05/07/21 10:56 PM,2021,ExRedPill
26,Tips for young men who have yacked the pill,,shootingstrz12345,/r/ExRedPill,21/06/21 12:58 AM,2021,ExRedPill
26,"I'm guessing this is a redpilled girl I came across but no matter what you think of someone's sexual past, comparing it to murder is absolutely gross as someone who has lost a family member to murder",,glowuptop,/r/ExRedPill,19/09/21 07:39 AM,2021,ExRedPill
26,What started me to redpill was 'the modern man' blog. That blog is toxic and it is what made me go toward red pill,,GoldenGrouper,/r/ExRedPill,07/05/21 09:37 PM,2021,ExRedPill
26,Sometimes I wonder if other posters are actually exredpill,,danielatsb,/r/ExRedPill,22/04/21 08:26 PM,2021,ExRedPill
26,"Hey guys, made a post on menslib regarding tiktok and it’s overlap with RP and such.",,Half-Ice-Half-Fire,/r/ExRedPill,14/06/21 02:58 PM,2021,ExRedPill
26,"this is the type of shit that got me into TRP. it makes me want to cry, man. i want to believe people in the world are good and people will love you for who *you *are but then again, this stuff happens. i know that the girl didn't owe the guy sex or love, he wasn't entitled to it but still, cmon",,Oistcute,/r/ExRedPill,23/08/21 03:25 PM,2021,ExRedPill
26,Does anybody have sources on the TRP sources?,,Zealousideal_Fee_231,/r/ExRedPill,01/06/21 05:15 PM,2021,ExRedPill
25,alpha m teaches me how to be a bad boy,,RayH99,/r/ExRedPill,26/05/21 03:00 AM,2021,ExRedPill
25,Myron Gaines impregnates their guest in Fresh and Fit who is an OnlyFans girl.,,BlackVsilver,/r/ExRedPill,22/08/21 07:46 AM,2021,ExRedPill
25,"RP-related narcissism/entitlement, how to deal with it?",,ExcellentItem,/r/ExRedPill,25/07/21 10:54 PM,2021,ExRedPill
25,Are all Red Pill methods for attracting women bullshit?,,Whole-Pea1870,/r/ExRedPill,01/09/21 09:28 PM,2021,ExRedPill
25,My short RP story 📖,,ChillwaveSos,/r/ExRedPill,15/11/21 06:24 PM,2021,ExRedPill
25,Do RedPillers have Attachment Trauma,,,/r/ExRedPill,15/12/21 02:35 AM,2021,ExRedPill
25,I've watched bunch of alpha male/ redpill videos just to realize those are either scams or just something neckbeards who flex on r/asktrp like to watch.,,imbecile_keshig,/r/ExRedPill,09/03/21 03:28 PM,2021,ExRedPill
25,Ladies of /exredpill what makes you want to help men leave the Red Pill?,,__changetheworld__,/r/ExRedPill,02/12/21 06:53 PM,2021,ExRedPill
25,How did take the red pill affect your relationship with your wife or girlfriend?,,ysl-toon,/r/ExRedPill,27/04/21 12:06 AM,2021,ExRedPill
25,"I found words for the rest, but have none left for a title",,InvictusAnima,/r/ExRedPill,12/08/21 12:15 AM,2021,ExRedPill
25,TRP grew me up in a lot of ways but it definitely stunted me in others.,,americanthrowaway59,/r/ExRedPill,31/05/21 12:54 PM,2021,ExRedPill
25,"Misconceptions about having ""confidence"".",,AdhesivenessOk9106,/r/ExRedPill,19/10/21 03:16 PM,2021,ExRedPill
25,Reminder: Ex-RedPill doesn't have to mean blindly accepting opposing viewpoints and completely rejecting your old beliefs,,No-Atmosphere-8532,/r/ExRedPill,21/03/21 08:12 PM,2021,ExRedPill
25,Why do women get put off by insecurity in men,,big_floppaa,/r/ExRedPill,08/03/21 08:45 PM,2021,ExRedPill
25,Brene Brown about men's gender role and shame about showing any weakness/vulnerability/being human,,OutsideBandicoot3,/r/ExRedPill,13/03/21 02:38 PM,2021,ExRedPill
25,I'm just curious why it is that so many Redpill guys are lacking in social skills.,,zoemondo,/r/ExRedPill,13/04/21 05:41 PM,2021,ExRedPill
25,I hate how TRP takes reading and turns into filth.,,Oistcute,/r/ExRedPill,21/08/21 02:58 PM,2021,ExRedPill
25,Philosophical Criticisms of Red Pill Stoicism,,imfinnacry,/r/ExRedPill,18/12/21 05:45 PM,2021,ExRedPill
25,The problem with dating coaches is the complete lack of standards in the coaching industry,,tiposk,/r/ExRedPill,13/02/21 08:27 PM,2021,ExRedPill
25,To all the women who swallowed The Red Pill (and are choking).,,philanthropist_ABC,/r/ExRedPill,28/09/21 01:19 AM,2021,ExRedPill
25,Contrapoints,,asdewtyz,/r/ExRedPill,30/06/21 03:49 AM,2021,ExRedPill
25,Help! I’m a narcissist and manipulative,,,/r/ExRedPill,20/03/21 04:37 AM,2021,ExRedPill
25,Subreddit for mocking internet fake guru?,,ImpressivePiccolo9,/r/ExRedPill,19/02/21 01:29 AM,2021,ExRedPill
24,"For those looking for a socially acceptable alternative to Red Pill, try the YouTube channel Charisma on Command",,diceblue,/r/ExRedPill,27/01/21 03:12 AM,2021,ExRedPill
24,Love isn't when somebody meets all your check boxes,,SnooMachines7712,/r/ExRedPill,19/01/21 09:43 PM,2021,ExRedPill
24,"Ex red pill men, did red pill constantly make you feel insecure about your masculinity?",,ModernlyVintage_me,/r/ExRedPill,30/09/21 03:02 AM,2021,ExRedPill
24,Regrets,,difficultconcept,/r/ExRedPill,30/08/21 01:11 AM,2021,ExRedPill
24,"This is some MGTOW sh*t right there, fellow gentlemen don't fall for this crap! I can't believe how this type of utter bullsh*ttery managed to garner over 1,3 mil subs...",,W-Pirate,/r/ExRedPill,18/06/21 11:31 PM,2021,ExRedPill
24,Is AF/BB male projection of the madonna/whore dichotomy?,,tiposk,/r/ExRedPill,24/09/21 09:05 PM,2021,ExRedPill
24,Women of exRed pill,,sqcaw23,/r/ExRedPill,18/09/21 02:27 AM,2021,ExRedPill
24,Bleedover,,Zyzzulu,/r/ExRedPill,01/03/21 10:13 PM,2021,ExRedPill
24,"Vegan Gains Exposes Red Pill Misogynist (""I don't think rape exists"")",,Pepper-Lion,/r/ExRedPill,28/05/21 10:11 PM,2021,ExRedPill
24,Red pill is the most depressing shit ever lol,,Erfaniscool1,/r/ExRedPill,16/08/21 01:07 PM,2021,ExRedPill
24,Here's the reason why women are picky,,No_Visual6984,/r/ExRedPill,09/10/21 12:40 AM,2021,ExRedPill
24,exredpill youtube channel is built,,zeroicemaze,/r/ExRedPill,02/02/21 02:00 AM,2021,ExRedPill
24,Is there a better way for men to talk about their problems outside the manosphere?,,No-Border680,/r/ExRedPill,22/08/21 05:34 PM,2021,ExRedPill
24,"""Nice guy"" misunderstanding....?",,NdN124,/r/ExRedPill,20/01/21 07:50 PM,2021,ExRedPill
24,How the treatment of men with mental issues can lead to them taking the red pill,,NdN124,/r/ExRedPill,07/07/21 10:47 PM,2021,ExRedPill
24,"Why People Cheat in Relationships, by Mark Manson",,RedPillDetox,/r/ExRedPill,09/02/21 02:22 PM,2021,ExRedPill
23,I cannot believe my fucking eyes,,FlakyImpact5838,/r/ExRedPill,25/08/21 11:52 PM,2021,ExRedPill
23,“She’s not wife material”,,FlakyImpact5838,/r/ExRedPill,12/08/21 03:59 PM,2021,ExRedPill
23,Watch Kevin Samuels have a complete meltdown after a 22yo calls him out on his sh*t,,Artistic_Ad_9081,/r/ExRedPill,15/08/21 06:44 PM,2021,ExRedPill
23,I don't get it,,prjj2001,/r/ExRedPill,13/06/21 02:00 PM,2021,ExRedPill
23,How do I (24M) come in peace with the fact that I will most probably remain forever alone?,,chambaramba3,/r/ExRedPill,19/06/21 08:08 PM,2021,ExRedPill
23,Should we be worried?,,SnooMachines7712,/r/ExRedPill,21/01/21 10:19 PM,2021,ExRedPill
23,If you want to detox you might want to cut down the time you spend in this place,,tiposk,/r/ExRedPill,11/10/21 09:12 PM,2021,ExRedPill
23,Do men become red pilled bc they're delusional about the kind of women they can get or do they just want help period?,,spankyourkopita,/r/ExRedPill,09/11/21 10:57 PM,2021,ExRedPill
23,The dangers of the “numbers game” “cold approach” method red pill coaches spew,,HEHEHEE33,/r/ExRedPill,19/08/21 04:43 PM,2021,ExRedPill
23,Where did most RP gurus go wrong in their lives to fill their minds and others with their nonsense?,,spankyourkopita,/r/ExRedPill,12/08/21 05:52 AM,2021,ExRedPill
23,Looking for advice for a friend,,TheAceOfSpades1998,/r/ExRedPill,21/02/21 03:05 AM,2021,ExRedPill
23,I don't know how I got notifications for this group.,,cabsmom2020,/r/ExRedPill,23/01/21 09:53 PM,2021,ExRedPill
23,"Nobody should label someone as a ""plate"" or ""count""",,Dododo0808,/r/ExRedPill,03/05/21 06:35 PM,2021,ExRedPill
23,Cause of resentment against women,,ZealousidealFig5,/r/ExRedPill,14/03/21 10:39 AM,2021,ExRedPill
23,ExRedPill & finding the balance,,untiliPEAK,/r/ExRedPill,05/07/21 12:45 AM,2021,ExRedPill
23,"Confidence is a byproduct of success, ""just be confident bro"" does not work.",,Gmed66,/r/ExRedPill,25/11/21 08:56 PM,2021,ExRedPill
23,what are some good sources for debunking manosphere talking point ?,,Worth_Supermarket348,/r/ExRedPill,27/08/21 11:41 PM,2021,ExRedPill
23,"Have any of you went against the advice of TRP/MGTOW and dated a woman they hate, considered undesirable or advise other men not to date and how was the experience?",,StrongSecurity,/r/ExRedPill,11/03/21 01:00 PM,2021,ExRedPill
23,The REAL REASON WHY red pillars want women to be completely dependent on them,,MicahMX700,/r/ExRedPill,26/06/21 02:54 PM,2021,ExRedPill
23,Kinda confused about a situation. Hope someone can enlighten me.,,Glad-Communication60,/r/ExRedPill,17/07/21 07:05 PM,2021,ExRedPill
22,"This is why you don't become red pilled- Dude tries to hit on some women, gets mad at rejection, calls them names, blames being an incel, and that they want Chad instead.",,spankyourkopita,/r/ExRedPill,08/10/21 09:21 AM,2021,ExRedPill
22,Question,,demodawgz,/r/ExRedPill,23/05/21 10:36 PM,2021,ExRedPill
22,"I recently got diagnosed with autism, which makes sense, but I also feel worse.",,KindKitten25055,/r/ExRedPill,22/11/21 01:03 AM,2021,ExRedPill
22,New study analyses causes for rise of sexlessness in America (Spoiler: It doesn't look good for TRP theory),,RedPillDetox,/r/ExRedPill,17/06/21 11:22 AM,2021,ExRedPill
22,This makes me think that maybe red pillers have a point about being emotional as a guy,,tylerclarke82,/r/ExRedPill,28/01/21 01:38 PM,2021,ExRedPill
22,Sheryl Sandberg bad boys quote,,Clear-War5922,/r/ExRedPill,07/08/21 12:40 PM,2021,ExRedPill
22,How is everyone,,prjj2001,/r/ExRedPill,26/05/21 09:41 PM,2021,ExRedPill
22,What the hell does being alpha even mean?,,spankyourkopita,/r/ExRedPill,14/12/21 10:54 PM,2021,ExRedPill
22,Are there any videos of redpillers getting humiliated,,prjj2001,/r/ExRedPill,24/05/21 09:40 PM,2021,ExRedPill
22,Help me help someone,,DjangoFentem,/r/ExRedPill,03/04/21 12:40 AM,2021,ExRedPill
333,"Red Pill sells you one of many possible perspectives for specific behaviours, which can be very wrong...and very destructive.",,UncouthCupcake,/r/ExRedPill,02/09/22 07:20 PM,2022,ExRedPill
315,"Isn't it hilarious how the actual 'alpha' of the planet right now, Volodymyr Zelensky, is nothing like the redpill clowns say an 'alpha male' should be like?",,IuliaValentina,/r/ExRedPill,28/02/22 09:51 PM,2022,ExRedPill
282,"Red Pillers, you aren’t single because you’re too short, your face is ugly, or because you’re not making six figures, it’s because your personality is shit",,Imper000,/r/ExRedPill,27/01/22 12:04 AM,2022,ExRedPill
231,Women In Their 30's Aren't Lowering Their Standards,,hippy_speed_ball,/r/ExRedPill,13/07/22 05:44 PM,2022,ExRedPill
222,I drove uber last night for few hours..so many couples,,No_Lifeguard_7053,/r/ExRedPill,15/02/22 05:53 PM,2022,ExRedPill
209,i dont know if it belongs here but This is what the Red pill community should have been. Without the misogyny and sexism. Just men comforting other men,,Mysterious-Zone-334,/r/ExRedPill,27/03/22 01:39 AM,2022,ExRedPill
186,"""MGTOW is disliked by women because the concept of men not putting up with them anymore scares them!"" No, it's because you never shut up about how awful women are and how much you hate them.",,uuuggghhhhhh9,/r/ExRedPill,13/10/22 03:00 PM,2022,ExRedPill
179,Rich COOPER DESTROYED MY MARRIAGE. I HATE HIM AND I HATE ALPHA MALES/RED PILL,,Shot-Cellist9635,/r/ExRedPill,26/07/22 07:19 AM,2022,ExRedPill
178,Stop trying to make Alpha males a thing,,alexbrove,/r/ExRedPill,12/11/22 09:12 AM,2022,ExRedPill
177,Redpillers claiming that young (18-29) women are **sexually** attracted to men in their 50s/60s: are they really this fucking delusional???,,Available-Ad-9338,/r/ExRedPill,03/09/22 05:27 PM,2022,ExRedPill
172,Redpill ruined the perfect relationship,,getzy131620,/r/ExRedPill,04/03/22 04:52 PM,2022,ExRedPill
170,"“Women peak at 18, men peak at 50” does anyone else find this extremely creepy, delusional, and hypocritical?",,uuuggghhhhhh9,/r/ExRedPill,28/06/22 08:26 PM,2022,ExRedPill
167,Andrew tate YouTube removed,,skon7,/r/ExRedPill,23/08/22 04:04 AM,2022,ExRedPill
164,"What does ""dread game"" mean and what does it do to the relationship and other person?",,NakedNyx,/r/ExRedPill,18/07/22 02:29 PM,2022,ExRedPill
159,"As an Ex-MGTOW, and I wish you all the best",,SuicidalAutist,/r/ExRedPill,17/06/22 01:03 AM,2022,ExRedPill
145,Took a big step today. Unfollowed all the dating youtube channels.,,Grappleheart,/r/ExRedPill,22/05/22 02:58 PM,2022,ExRedPill
140,Murdering with kindness,,alexbrove,/r/ExRedPill,27/12/22 09:10 PM,2022,ExRedPill
133,MGTOW YouTube channels are quite literally just woman hate channels,,uuuggghhhhhh9,/r/ExRedPill,29/04/22 05:47 PM,2022,ExRedPill
133,What are the destruction possibilities of misrepresentation and morality within the Red Pill dating and sex scene?,,YourFavouriteCupcake,/r/ExRedPill,01/08/22 08:04 PM,2022,ExRedPill
133,Red pill ruined my relationship and is ruining my life,,IAMSUPERVEGETA-,/r/ExRedPill,12/06/22 07:45 PM,2022,ExRedPill
